"Identifier","Context","Source string","Translation"
"BBZE009TO","System","Shimmy on bar with {MovementControls}","Розгойдуйтеся по трубі за допомогою {MovementControls}"
"BBZE010TO","System","Swing on bar with {MovementControls}","Гойдайтеся по трубі за допомогою {MovementControls}"
"BBZE011TO","System","Use {MovementControls} to shimmy across ledge.","Використовуйте {MovementControls}, щоб лізти по уступу."
"BBZE012TO","System","Use {MovementControls} with {AButton} to switch rails.",""
"BBZF006TO","System","Swing or shimmy with {MovementControls}",""
"BBZF008TO","System","Press {RClick} to enter first-person camera mode. Then move the {LookControls} to look around.","Натисніть {RClick}, щоб увійти в режим від першого обличчя. Потім рухайте {LookControls}, щоб оглядатися."
