"identifier","labels","context","source","translation"
"ASCL001RA","ASCL","Raz","Hey it works!","Hey it works!"
"ASCL002RA","ASCL","Raz","What's up, Linda?","What's up, Linda?"
"ASCL003RA","ASCL","Raz","I don't suppose I could just ride on top this time?","I don't suppose I could just ride on top this time?"
"ASCL004RA","ASCL","Raz","You know, I'm not getting any more used to this.","You know, I'm not getting any more used to this."
"ASCL005RA","ASCL","Raz","You haven't been eating algae again, have you?","You haven't been eating algae again, have you?"
"ASCL006LF","ASCL","Linda","Prepare yourself for passage, human child.","Prepare yourself for passage, human child."
"ASCL007RA","ASCL","Raz","Ya--","Ya--"
"LLBF001RA","LLBF","Raz","Okay, cough up the girl and no one gets hurt, fish!","Okay, cough up the girl and no one gets hurt, fish!"
"LLBF002LF","LLBF","Linda","Rrrrrrrrroooooooooaaaahhhhh!","Rrrrrrrrroooooooooaaaahhhhh!"
"LLBF003RA","LLBF","Raz","Man, it's gonna be hard to find a new place to give you lumps.","Man, it's gonna be hard to find a new place to give you lumps."
"LLLV001LF","LLLV","Linda","Human child.","Human child."
"LLLV002RA","LLLV","Raz","Wha--who is that?","Wha--who is that?"
"LLLV003LF","LLLV","Linda","It is I, the creature whose spirit was once--","It is I, the creature whose spirit was once--"
"LLLV004LF","LLLV","Linda","Um, over here. Behind you? Yes.","Um, over here. Behind you? Yes."
"LLLV005RA","LLLV","Raz","Oh.","Oh."
"LLLV006LF","LLLV","Linda","The creature whose spirit was once enslaved by the evil one.","The creature whose spirit was once enslaved by the evil one."
"LLLV007LF","LLLV","Linda","You have unchained my soul, and now I shall repay you, powerful human child!","You have unchained my soul, and now I shall repay you, powerful human child!"
"LLLV008RA","LLLV","Raz","Oh, uh... great! Well okay, show me what you did to my friend Lili!","Oh, uh... great! Well okay, show me what you did to my friend Lili!"
"LLLV009LF","LLLV","Linda","By the drowned spirit of Oblongata, it is done!","By the drowned spirit of Oblongata, it is done!"
"LLLV010RA","LLLV","Raz","Ah--","Ah--"
"LLAA000RA","LLAA","Raz","Man, that must be full of sharp nails. Hate to swallow that!","Man, that must be full of sharp nails. Hate to swallow that!"
"LLAA001RA","LLAA","Raz","""Shaky Claim Day Care Center.""","""Shaky Claim Day Care Center."""
"LLAA002RA","LLAA","Raz","Wow, this must have been a pretty advanced ghost town down here if they had lawn gnomes.","Wow, this must have been a pretty advanced ghost town down here if they had lawn gnomes."
"LLAA003RA","LLAA","Raz","Hey, that helmet got spit at me in the Brain Tumbler vision!","Hey, that helmet got spit at me in the Brain Tumbler vision!"
"LLAA004RA","LLAA","Raz","I must have been fighting the Coach's idea of this monster.","I must have been fighting the Coach's idea of this monster."
"LLAA005RA","LLAA","Raz","I mean, Linda.","I mean, Linda."
"LLAA006RA","LLAA","Raz","Ooh, I wonder if I can find out what happened on that western I was watching. ","Ooh, I wonder if I can find out what happened on that western I was watching. "
"LLAA007RA","LLAA","Raz","Poor, gross little sucker fish! It can't breathe! I should kill it.","Poor, gross little sucker fish! It can't breathe! I should kill it."
"LLAA008RA","LLAA","Raz","Hey, I think I see a piece of teriyaki salmon jerky over there in that clam. Why don't you go eat that instead?","Hey, I think I see a piece of teriyaki salmon jerky over there in that clam. Why don't you go eat that instead?"
"LLAA009RA","LLAA","Raz","This freshwater lake coral is so pretty I just want to smash it.","This freshwater lake coral is so pretty I just want to smash it."
"LLAA010RA","LLAA","Raz","The creature's prints are still glowing! This must be where he brought Lili!","The creature's prints are still glowing! This must be where he brought Lili!"
"LLAB000FO","LLAB","Ford","Ah, poor little thing.","Ah, poor little thing."
"LLAB001RA","LLAB","Raz","That ""poor little thing"" just tried to kill me about eight different ways.","That ""poor little thing"" just tried to kill me about eight different ways."
"LLAB002FO","LLAB","Ford","Well, that's not its fault.","Well, that's not its fault."
"LLAB003FO","LLAB","Ford","This was once just a normal-sized lungfish, minding its own business in a mucus-lined air bubble beneath a semi-dry lake bed.","This was once just a normal-sized lungfish, minding its own business in a mucus-lined air bubble beneath a semi-dry lake bed."
"LLAB004FO","LLAB","Ford","But judging by the work done on it, I suspect Morry has mutated it, accelerated its growth, and has placed an implant in its brain to make it do his evil bidding.","But judging by the work done on it, I suspect Morry has mutated it, accelerated its growth, and has placed an implant in its brain to make it do his evil bidding."
"LLAB005RA","LLAB","Raz","Whoa. Poor little thing.","Whoa. Poor little thing."
"LLAB006FO","LLAB","Ford","Yeah. Go inside there and try to smash the implant! Use the Psycho-Portal I saw you steal from Sasha's lab.","Yeah. Go inside there and try to smash the implant! Use the Psycho-Portal I saw you steal from Sasha's lab."
"LLAB007RA","LLAB","Raz","Oh, uh, yeah. That works on big, scary monsters?","Oh, uh, yeah. That works on big, scary monsters?"
"LLAB008FO","LLAB","Ford","Oh, monster-schmonster! That thing is more afraid of you than you are of it! ","Oh, monster-schmonster! That thing is more afraid of you than you are of it! "
"LLAB009FO","LLAB","Ford","Now git in there!","Now git in there!"
"LLAC000LF","LLAC","Linda","Please... my home is your home.","Please... my home is your home."
"LLAC001LF","LLAC","Linda","I think I have some Teriyaki Salmon Jerky in one of these mud holes around here...","I think I have some Teriyaki Salmon Jerky in one of these mud holes around here..."
"LLAC002RA","LLAC","Raz","No, that's cool. Why don't you just relax. I'd like to poke around.","No, that's cool. Why don't you just relax. I'd like to poke around."
"LLAC003LF","LLAC","Linda","As you wish, human child.","As you wish, human child."
"LLAC004RA","LLAC","Raz","Hey, Linda?","Hey, Linda?"
"LLAC005LF","LLAC","Linda","Yes.","Yes."
"LLAC006RA","LLAC","Raz","Could you take me back to camp now?","Could you take me back to camp now?"
"LLAC007RA","LLAC","Raz","Could you take me back to the Asylum?","Could you take me back to the Asylum?"
"LLAC008RA","LLAC","Raz","Nothing. I just wanted to make sure you're not dead.","Nothing. I just wanted to make sure you're not dead."
"LLAC009LF","LLAC","Linda","As you wish.","As you wish."
"LLAD001RA","LLAD","Raz","Sorry. False alarm.","Sorry. False alarm."
"LLAD002LF","LLAD","Linda","(Sigh.)","(Sigh.)"
"LLAD003RA","LLAD","Raz","Thanks, Linda!","Thanks, Linda!"
"LLAD004LF","LLAD","Linda","Um-hm.","Um-hm."
"LLZF000TO","LLZF","System","Punch coral to break it.","Punch coral to break it."
"LLZZ000TO","LLZZ","System","Shakey Claim Nail Factory","Shakey Claim Nail Factory"
