"id","character","origin_dialogue","translated_dialogue"
"LOIN001LP","Lungfish-Police","Ah, top of the mornin' to ya, ma'am.","Ah, top of the mornin' to ya, ma'am."
"LOIN002LY","Lungfish-Madam","And good day to you, Officer O'Lungfish. How are you today?","And good day to you, Officer O'Lungfish. How are you today?"
"LOIN003LP","Lungfish-Police","Oh, damp and happy. Can't complain! And what are you and the wee one up to on this lovely day?","Oh, damp and happy. Can't complain! And what are you and the wee one up to on this lovely day?"
"LOIN004LY","Lungfish-Madam","Oh, just obeying the law as always. All posted directives followed to the letter.","Oh, just obeying the law as always. All posted directives followed to the letter."
"LOIN005LP","Lungfish-Police","Ah, good to hear! Not a one of us want any trouble that's for sure!","Ah, good to hear! Not a one of us want any trouble that's for sure!"
"LOIN006LY","Lungfish-Madam","Aaaaahhhhh!!!!","Aaaaahhhhh!!!!"
"LOIN007LP","Lungfish-Police","Aaaaaahhhh!!!!","Aaaaaahhhh!!!!"
"LOIN008LR","Lungfish-Resistance","Oh, Goggalor!!!!","Oh, Goggalor!!!!"
"LOVE001CO","Coach","Agggghhh!","Agggghhh!"
"LOVE002CO","Coach","Fine! Take control of this freaky toad! I don't need him to nab children for me anymore!","Fine! Take control of this freaky toad! I don't need him to nab children for me anymore!"
"LOVE003CO","Coach","I've got the brain of a little girl back in my lab that's strong enough to power a whole army of Psychoblaster Death Tanks!","I've got the brain of a little girl back in my lab that's strong enough to power a whole army of Psychoblaster Death Tanks!"
"LOVE004RA","Raz","Why you--heh heh!","Why you--heh heh!"
"LOVE005CO","Coach","Wha--","Wha--"
"LOVE006RA","Raz","Ha ha ha!","Ha ha ha!"
"LOVE007CO","Coach","What?","What?"
"LOVE008RA","Raz","You've got the brain of a little girl! Ha ha ha!","You've got the brain of a little girl! Ha ha ha!"
"LOVE009CO","Coach","I said in my lab!","I said in my lab!"
"LOVE010RA","Raz","I think you've got the muscles of a little girl, too.","I think you've got the muscles of a little girl, too."
"LOVE012CO","Coach","Ahhhh! Grrrrr!","Ahhhh! Grrrrr!"
"LOVE013CO","Coach","Good one!","Good one!"
"LOAB005Z1","Zealots-1","Freedom!","Freedom!"
"LOAB014Z1","Zealots-1","WOOOOO!","WOOOOO!"
"LOAB015Z1","Zealots-1","FREEDO--","FREEDO--"
"LOAB109Z1","Zealots-1","FREEDOM!","FREEDOM!"
"LOCP001LC","Lungfish-Citizen","Ahhhhhhhhh!","Ahhhhhhhhh!"
"LOCP002LC","Lungfish-Citizen","Kochamara, save us!","Kochamara, save us!"
"LOCP003LC","Lungfish-Citizen","Where is Kochamara?","Where is Kochamara?"
"LOCP004LC","Lungfish-Citizen","Ah, my house!","Ah, my house!"
"LOCP005LC","Lungfish-Citizen","That's my school! ... Hooray!","That's my school! ... Hooray!"
"LOCP006LC","Lungfish-Citizen","Heeeeelllllllp!","Heeeeelllllllp!"
"LOCP007LC","Lungfish-Citizen","It's Goggalor! Run!","It's Goggalor! Run!"
"LOCP008LC","Lungfish-Citizen","Please don't kill me, Goggalor!","Please don't kill me, Goggalor!"
"LOCP009LC","Lungfish-Citizen","It's Goggalor! He hates children!","It's Goggalor! He hates children!"
"LOCP010LC","Lungfish-Citizen","Hey everyone, here comes Kochamara! No, wait, it's Goggalor. RUN!","Hey everyone, here comes Kochamara! No, wait, it's Goggalor. RUN!"
"LOCP011LC","Lungfish-Citizen","Bullets don't hurt him!","Bullets don't hurt him!"
"LOCP012LC","Lungfish-Citizen","Why, Goggalor, why?","Why, Goggalor, why?"
"LOCP013LC","Lungfish-Citizen","Nothing can stop him!","Nothing can stop him!"
"LOCP014LC","Lungfish-Citizen","Where are the police?","Where are the police?"
"LOCP015LC","Lungfish-Citizen","Go back to your watery hell, Goggalor!","Go back to your watery hell, Goggalor!"
"LOCP017LC","Lungfish-Citizen","I hate you, Goggalor!","I hate you, Goggalor!"
"LOCP018LC","Lungfish-Citizen","Nooooooooooo! Not the natural history museum!","Nooooooooooo! Not the natural history museum!"
"LOCP019LC","Lungfish-Citizen","Oh no, Goggalor's heading for the orphanage!","Oh no, Goggalor's heading for the orphanage!"
"LOCP020LC","Lungfish-Citizen","It's okay everyone. Goggalor missed the orphanage!","It's okay everyone. Goggalor missed the orphanage!"
"LOCP021LC","Lungfish-Citizen","No wait he's still heading for the orphanage!","No wait he's still heading for the orphanage!"
"LOCP022LC","Lungfish-Citizen","Oh my god, the orphanage!","Oh my god, the orphanage!"
"LOCP023LC","Lungfish-Citizen","Hold on--that wasn't the orphanage.","Hold on--that wasn't the orphanage."
"LOCP024LC","Lungfish-Citizen","Oh no, it was the orphanage--for dogs. It was the puppy orphanage everyone!","Oh no, it was the orphanage--for dogs. It was the puppy orphanage everyone!"
"LOCP025LC","Lungfish-Citizen","No wait--I spoke too fast.","No wait--I spoke too fast."
"LOCP026LC","Lungfish-Citizen","It was just a mattress factory.","It was just a mattress factory."
"LOCP027LC","Lungfish-Citizen","Okay, that's not too bad.","Okay, that's not too bad."
"LOCP028LC","Lungfish-Citizen","Ahhhhh, my mattress factory! I'm ruined!","Ahhhhh, my mattress factory! I'm ruined!"
"LOCP029LC","Lungfish-Citizen","I love you Goggalor!","I love you Goggalor!"
"LOCP030LC","Lungfish-Citizen","Good lord, he's impervious to bullets and love!","Good lord, he's impervious to bullets and love!"
"LOCP031LC","Lungfish-Citizen","Why doesn't the Navy electrocute him?","Why doesn't the Navy electrocute him?"
"LOCP032LC","Lungfish-Citizen","I don't want to complain, but Kochamara should do something.","I don't want to complain, but Kochamara should do something."
"LOCP033LC","Lungfish-Citizen","Holy smokes, those goggles are five thousand meters tall!","Holy smokes, those goggles are five thousand meters tall!"
"LOCP034LC","Lungfish-Citizen","Oh no. Ohhhhh no. Noooooooo!","Oh no. Ohhhhh no. Noooooooo!"
"LOCP035LC","Lungfish-Citizen","You're lucky we can't own guns, Goggalor!","You're lucky we can't own guns, Goggalor!"
"LOCP036LC","Lungfish-Citizen","We've faced monsters like you before, Goggalor, only much smaller.","We've faced monsters like you before, Goggalor, only much smaller."
"LOCP037LC","Lungfish-Citizen","My car!","My car!"
"LOCP038LC","Lungfish-Citizen","My bait shop!","My bait shop!"
"LOCP039LC","Lungfish-Citizen","My tank!","My tank!"
"LOCP040LC","Lungfish-Citizen","My cheese shop!","My cheese shop!"
"LOCP041LC","Lungfish-Citizen","My outlet store!","My outlet store!"
"LOCP042LC","Lungfish-Citizen","Gahhhhhhhhh!","Gahhhhhhhhh!"
"LOZI001Z1","Zealots-1","Hey! Goggalor! Down here!","Hey! Goggalor! Down here!"
"LOZI002RA","Raz","Excuse me, were you talking to me?","Excuse me, were you talking to me?"
"LOZI003Z1","Zealots-1","Ahhhhhh! Owwwww! My ears!","Ahhhhhh! Owwwww! My ears!"
"LOZI004RA","Raz","I'm sorry.","I'm sorry."
"LOZI005Z1","Zealots-1","Ahhhhhh! Oh my god! Ahhhhhhhh!","Ahhhhhh! Oh my god! Ahhhhhhhh!"
"LOZI006RA","Raz","Are you okay?","Are you okay?"
"LOZI007Z2","Zealots-2","He's dead!","He's dead!"
"LOZI008RA","Raz","Oh jeez, I'm sorry.","Oh jeez, I'm sorry."
"LOZI009Z2","Zealots-2","Don't worry, every member of the resistance is prepared to die fighting the tyranny of Kochamara.","Don't worry, every member of the resistance is prepared to die fighting the tyranny of Kochamara."
"LOZI010RA","Raz","What's Kochamara?","What's Kochamara?"
"LOZI011Z2","Zealots-2","He's a giant monster like you, Goggalor. He brainwashed and enslaved almost everyone in Lungfishopolis.","He's a giant monster like you, Goggalor. He brainwashed and enslaved almost everyone in Lungfishopolis."
"LOZI012RA","Raz","That stinks. So hey, have you seen any other humans around here? I'm looking for a girl called Lili.","That stinks. So hey, have you seen any other humans around here? I'm looking for a girl called Lili."
"LOZI015Z2","Zealots-2","The government archives might have some information about your young girlfriend, Goggalor.","The government archives might have some information about your young girlfriend, Goggalor."
"LOZI016RA","Raz","I don't know if she's really my girlfriend. I mean, I think she--","I don't know if she's really my girlfriend. I mean, I think she--"
"LOZI017Z2","Zealots-2","I only meant that she is your friend who is a girl, Goggalor. To access the archives, we must first destroy the broadcast tower Kochamara uses to control the populace.","I only meant that she is your friend who is a girl, Goggalor. To access the archives, we must first destroy the broadcast tower Kochamara uses to control the populace."
"LOZI018RA","Raz","Check. I'll go smash that, then.","Check. I'll go smash that, then."
"LOZI019Z2","Zealots-2","Wait, Goggalor! In order to reach the tower, you'll need to pass through that wall of lasers. But you'll never make it through the lasers without our help.","Wait, Goggalor! In order to reach the tower, you'll need to pass through that wall of lasers. But you'll never make it through the lasers without our help."
"LOZI020RA","Raz","So are you gonna start helping soon?","So are you gonna start helping soon?"
"LOZI021Z2","Zealots-2","First, I need you to do something for the resistance. Punch a hole in that prison and free my comrades!","First, I need you to do something for the resistance. Punch a hole in that prison and free my comrades!"
"LOZI025RA","Raz","Hooyah! Now how about getting me past those gates?","Hooyah! Now how about getting me past those gates?"
"LOZI026Z1","Zealots-1","Right. We stole this shield power module from Kochamara. It's too big for any of us to operate, but it should work for you.","Right. We stole this shield power module from Kochamara. It's too big for any of us to operate, but it should work for you."
"LOZI027RA","Raz","Hey, is this gonna upset Kochamara and all your little brainwashed neighbors?","Hey, is this gonna upset Kochamara and all your little brainwashed neighbors?"
"LOZI028Z1","Zealots-1","Nooo.","Nooo."
"LOZI029Z2","Zealots-2","I doubt it.","I doubt it."
"LOZI030Z3","Zealots-3","Uh, no no no.","Uh, no no no."
"LOZI031RA","Raz","So knocking down the prison and then breaking this laser shield thing--nobody's gonna get mad about that and start shooting at me?","So knocking down the prison and then breaking this laser shield thing--nobody's gonna get mad about that and start shooting at me?"
"LOZI032Z1","Zealots-1","Nooooo!","Nooooo!"
"LOZI033Z2","Zealots-2","Uhh, maybe one guy would.","Uhh, maybe one guy would."
"LOZI034Z1","Zealots-1","But what is even an entire navy of Lungfish against the might and revolutionary zeal of Goggalor!","But what is even an entire navy of Lungfish against the might and revolutionary zeal of Goggalor!"
"LOZI035RA","Raz","Wait, what Navy?","Wait, what Navy?"
"LOZI036Z1","Zealots-1","Meet us at the dam, Goggalor. FOR FREEDOM!","Meet us at the dam, Goggalor. FOR FREEDOM!"
"LOZM003Z1","Zealots-1","Goggalor, come in! We have commandeered these vessels in your name!","Goggalor, come in! We have commandeered these vessels in your name!"
"LOZM004Z2","Zealots-2","We can put them in position to help you cross Kochamara Channel, to get to Kochamara Island, and destroy Kochamara Tower!","We can put them in position to help you cross Kochamara Channel, to get to Kochamara Island, and destroy Kochamara Tower!"
"LOZM005Z1","Zealots-1","The thing is that, uh, although you have had SEVERAL excellent plans today, Goggalor... We... Uh","The thing is that, uh, although you have had SEVERAL excellent plans today, Goggalor... We... Uh"
"LOZM006Z2","Zealots-2","Er, we just think it best, uh... to... er uh","Er, we just think it best, uh... to... er uh"
"LOZM007Z1","Zealots-1","We've decided to maintain our position out here.","We've decided to maintain our position out here."
"LOZM008Z2","Zealots-2","Just until you clear the area of all hostiles.","Just until you clear the area of all hostiles."
"LOZM009Z1","Zealots-1","Yes.","Yes."
"LOZM010Z2","Zealots-2","For insurance reasons, Goggalor.","For insurance reasons, Goggalor."
"LOZM011Z1","Zealots-1","Yes! That, and for Freedom!","Yes! That, and for Freedom!"
"LOZJ001TO","System","Terror in Lungfishopolis","Terror in Lungfishopolis"
"LOAA001CO","Coach","The peaceful city of Lungfishopolis is under attack tonight by a hideous, gigantic monster the terrified citizens have named, ""Goggalor.""","The peaceful city of Lungfishopolis is under attack tonight by a hideous, gigantic monster the terrified citizens have named, ""Goggalor."""
"LOAA002CO","Coach","The navy has responded quickly and decisively, dispatching its entire tank division to neutralize the creature.","The navy has responded quickly and decisively, dispatching its entire tank division to neutralize the creature."
"LOAA003CO","Coach","Soon, authorities say, everything will return to normal or better.","Soon, authorities say, everything will return to normal or better."
"LOAA004CO","Coach","(Kidnapping human children is good.)","(Kidnapping human children is good.)"
"LOZJ000TO","System","Goggalor: On Drugs?","Goggalor: On Drugs?"
"LOAD001CO","Coach","Well, things have gotten a little embarrassing for Goggalor. Recently surfaced information has strongly linked the previously intimidating monster with common lowlife criminals.","Well, things have gotten a little embarrassing for Goggalor. Recently surfaced information has strongly linked the previously intimidating monster with common lowlife criminals."
"LOAD002CO","Coach","Earlier tonight, Goggalor broke some of his jailhouse cronies out of the slammer so they could enjoy a night on the town, popping pills, and soliciting inexpensive call girls.","Earlier tonight, Goggalor broke some of his jailhouse cronies out of the slammer so they could enjoy a night on the town, popping pills, and soliciting inexpensive call girls."
"LOAD003CO","Coach","Well, they're in for one nasty hangover! Our beloved Navy has come up with a high-tech new invention: trucks armed with HYPER-ELECTRICITY!!!","Well, they're in for one nasty hangover! Our beloved Navy has come up with a high-tech new invention: trucks armed with HYPER-ELECTRICITY!!!"
"LOAD004CO","Coach","(When kidnapping children, do not harm the brains.)","(When kidnapping children, do not harm the brains.)"
"LOZJ002TO","System","No Quarter from Goggalor","No Quarter from Goggalor"
"LOAE001CO","Coach","The destruction and terror continue as the hulking, godless child-beast carves a bloody swath through our helpless city.","The destruction and terror continue as the hulking, godless child-beast carves a bloody swath through our helpless city."
"LOAE002CO","Coach","Our noble, all-volunteer Navy has been surprised only by the senseless lust for mayhem that seeps from the twisted, black lump of a heart in this creature, still known only as Goggalor.","Our noble, all-volunteer Navy has been surprised only by the senseless lust for mayhem that seeps from the twisted, black lump of a heart in this creature, still known only as Goggalor."
"LOAE003CO","Coach","Though it loathes violence in all its forms, the Navy has no choice but to activate its Anti-Monster Turrets, which it guarantees are 100% monster proof.","Though it loathes violence in all its forms, the Navy has no choice but to activate its Anti-Monster Turrets, which it guarantees are 100% monster proof."
"LOAE004CO","Coach","(Do not get caught stealing children.)","(Do not get caught stealing children.)"
"LOZJ003TO","System","Famous Child Star Hates Goggalor","Famous Child Star Hates Goggalor"
"LOAF001CO","Coach","We're here with the star of the popular sitcom, ""Trouble in the Bubble,"" Buddy Finn. ","We're here with the star of the popular sitcom, ""Trouble in the Bubble,"" Buddy Finn. "
"LOAF002CO","Coach","Buddy, what's your take on the Goggalor situation? Is he just misunderstood? ","Buddy, what's your take on the Goggalor situation? Is he just misunderstood? "
"LOAF003CO","Coach","No way! I hate Goggalor! I can't imagine any one of my fans siding with the monster. He hates everything Lungfish care about--","No way! I hate Goggalor! I can't imagine any one of my fans siding with the monster. He hates everything Lungfish care about--"
"LOAF004CO","Coach","Air, water, family, the economy...","Air, water, family, the economy..."
"LOAF005CO","Coach","Buddy, you'll be happy to know that the Navy has decided to pull out what they're most famous for: ","Buddy, you'll be happy to know that the Navy has decided to pull out what they're most famous for: "
"LOAF007CO","Coach","So, rest assured, we can all look forward to Goggalor's imminent death, and to seeing you, Buddy, every Thursday night at eight, right here on LBC!","So, rest assured, we can all look forward to Goggalor's imminent death, and to seeing you, Buddy, every Thursday night at eight, right here on LBC!"
"LOAF008CO","Coach","Thanks, and I'd just like to add that if anyone kidnaps a human child they should take them quickly under the lake to the abandoned insane asylum.","Thanks, and I'd just like to add that if anyone kidnaps a human child they should take them quickly under the lake to the abandoned insane asylum."
"LOZJ004TO","System","The End is Nigh","The End is Nigh"
"LOAG001CO","Coach","Well, we're sorry to report that the miserable and incompetent Lungfish Navy is all but sunk.","Well, we're sorry to report that the miserable and incompetent Lungfish Navy is all but sunk."
"LOAG002CO","Coach","Great work, losers!","Great work, losers!"
"LOAG003CO","Coach","Now Kochamara himself will have to come all the way down here just to save our worthless hides. ","Now Kochamara himself will have to come all the way down here just to save our worthless hides. "
"LOAG004CO","Coach","Authorities are calling for a big parade in Kochamara's honor after he clobbers the annoying giant Goggalor, and if the parade is big enough, Kochamara promises NOT to destroy the city.","Authorities are calling for a big parade in Kochamara's honor after he clobbers the annoying giant Goggalor, and if the parade is big enough, Kochamara promises NOT to destroy the city."
"LOAG005CO","Coach","(Brush teeth more often. Don't drool so much.)","(Brush teeth more often. Don't drool so much.)"
"LOAH000Z1","Zealots-1","Goggalor, what are you doing down here?","Goggalor, what are you doing down here?"
"LOAH001RA","Raz","I'm trying to get to that Kochamara Tower thing so I can smash it.","I'm trying to get to that Kochamara Tower thing so I can smash it."
"LOAH002Z1","Zealots-1","The laser tunnel, Goggalor. We have to get through that or we'll never get to Kochamara Island!","The laser tunnel, Goggalor. We have to get through that or we'll never get to Kochamara Island!"
"LOAH003RA","Raz","But I thought--","But I thought--"
"LOAH004Z1","Zealots-1","There is no ""I"" in team, Goggalor!","There is no ""I"" in team, Goggalor!"
"LOAH005RA","Raz","Yeah, but there's an ""I"" in ""squish"" so watch it.","Yeah, but there's an ""I"" in ""squish"" so watch it."
"LOAH006RA","Raz","I'll go take out your laser tunnel, but then we're going to talk about who's running this revolution.","I'll go take out your laser tunnel, but then we're going to talk about who's running this revolution."
"LOAI000Z1","Zealots-1","Goggalor! Another jail to smash! Take it out and free the prisoners, Goggalor!","Goggalor! Another jail to smash! Take it out and free the prisoners, Goggalor!"
"LOAI002Z4","Zealots-4","So this big monster, is that the best you could do?","So this big monster, is that the best you could do?"
"LOAI003Z1","Zealots-1","We were short on time, and he is good at smashing things!","We were short on time, and he is good at smashing things!"
"LOAI004Z4","Zealots-4","Doesn't look like much to me. Come on, let's blow this joint.","Doesn't look like much to me. Come on, let's blow this joint."
"LOAI005RA","Raz","Hey, you're welcome!","Hey, you're welcome!"
"LOAI006Z1","Zealots-1","Sorry about him, Goggalor. He's been in prison a long time.","Sorry about him, Goggalor. He's been in prison a long time."
"LOAI007Z1","Zealots-1","He's the only pilot the resistance has, and he has an excellent plan! ","He's the only pilot the resistance has, and he has an excellent plan! "
"LOAI008Z1","Zealots-1","Meet us at the dam so we can put it into action!","Meet us at the dam so we can put it into action!"
"LOAI009Z1","Zealots-1","Ha! Now you see the genius of our plan, Goggalor!","Ha! Now you see the genius of our plan, Goggalor!"
"LOAI010Z4","Zealots-4","First, we print flyers. Then we spread them all over town with my blimp!","First, we print flyers. Then we spread them all over town with my blimp!"
"LOAI011Z1","Zealots-1","Winning over the hearts and minds of Lungfishopolis in as soon as six months.","Winning over the hearts and minds of Lungfishopolis in as soon as six months."
"LOAI012RA","Raz","Six months?","Six months?"
"LOAI013Z4","Zealots-4","You don't like our plan, you can come up with another one!","You don't like our plan, you can come up with another one!"
"LOAI014Z1","Zealots-1","Yes, we are busy! We have to select card stock, and then find a decent, but inexpensive printer within the week.","Yes, we are busy! We have to select card stock, and then find a decent, but inexpensive printer within the week."
"LOAI015Z4","Zealots-4","Hey, what are you doing up there?","Hey, what are you doing up there?"
"LOAI016Z4","Zealots-4","Ow!","Ow!"
"LOAI017Z4","Zealots-4","Hey!","Hey!"
"LOAI018Z1","Zealots-1","Careful! My chai tea!","Careful! My chai tea!"
"LOAI019Z4","Zealots-4","Quit it!","Quit it!"
"LOAI020Z4","Zealots-4","Knock it off!","Knock it off!"
"LOAI021Z4","Zealots-4","We don't have a replacement blimp, you know!","We don't have a replacement blimp, you know!"
"LOAI022RA","Raz","Have you come up with a better plan than the pamphlets yet?","Have you come up with a better plan than the pamphlets yet?"
"LOAI023Z4","Zealots-4","Yes, it's called ""Turn in Goggalor for Reward Money.""","Yes, it's called ""Turn in Goggalor for Reward Money."""
"LOAI024RA","Raz","Hey, you guys still in there? It's Goggalor!","Hey, you guys still in there? It's Goggalor!"
"LOAI025Z4","Zealots-4","Oh, this guy. Just ignore him. He'll go away. ","Oh, this guy. Just ignore him. He'll go away. "
"LOZN000Z1","Zealots-1","The thing is that, uh, although we have the utmost faith that you will soon contain the area, Goggalor we... uh","The thing is that, uh, although we have the utmost faith that you will soon contain the area, Goggalor we... uh"
"LOAJ000CO","Coach","Give up while you can, Goggalor!","Give up while you can, Goggalor!"
"LOAJ001RA","Raz","I know it's you in there, Coach! I don't know where you're broadcasting from, but I'm going to find out and make you show me what happened to Lili.","I know it's you in there, Coach! I don't know where you're broadcasting from, but I'm going to find out and make you show me what happened to Lili."
"LOAJ002CO","Coach","Kochamara does not speak giant monster boy language.","Kochamara does not speak giant monster boy language."
"LOAJ003RA","Raz","The only word you're going to need is ""Ouch.""","The only word you're going to need is ""Ouch."""
"LOAJ004CO","Coach","Miiiiiiiiiiightyyyyyyyyyyyyy... ","Miiiiiiiiiiightyyyyyyyyyyyyy... "
"LOAJ005CO","Coach","RAM!","RAM!"
"LOAJ006CO","Coach","Deeeeeeaaaadlyyyyyyyyy...","Deeeeeeaaaadlyyyyyyyyy..."
"LOAJ007CO","Coach","TRIANGLE BEAM!","TRIANGLE BEAM!"
"LOAJ008CO","Coach","Hmm. So Sasha's showed you how to save up your aggressive energy, huh?","Hmm. So Sasha's showed you how to save up your aggressive energy, huh?"
"LOAJ009CO","Coach","Well, why don't I help you","Well, why don't I help you"
"LOAJ010CO","Coach","Let it all out!","Let it all out!"
"LOAJ011CO","Coach","Bwah ha ha!","Bwah ha ha!"
"LOAJ012CO","Coach","Whaddya going to do now, eh?","Whaddya going to do now, eh?"
"LOAJ013CO","Coach","Oh no! No ammo!","Oh no! No ammo!"
"LOAJ014CO","Coach","I'm lost without my ammo!","I'm lost without my ammo!"
"LOAJ015CO","Coach","I'm nothing without my cheater PSI Blast!","I'm nothing without my cheater PSI Blast!"
"LOAJ016CO","Coach","Oh, Sasha, Sasha. Come help me.","Oh, Sasha, Sasha. Come help me."
"LOAJ017CO","Coach","I have no defenses of my own!","I have no defenses of my own!"
"LOAJ018CO","Coach","Miiiiightyyy Raaaaam...","Miiiiightyyy Raaaaam..."
"LOAJ019CO","Coach","GROUND VERSION!","GROUND VERSION!"
"LOAJ020CO","Coach","Speeeeee-deeeeeee...","Speeeeee-deeeeeee..."
"LOAJ021CO","Coach","KICK!","KICK!"
"LOAJ022CO","Coach","Ooooverrrrrlyyyyy Innnnn-triiiiii-cate","Ooooverrrrrlyyyyy Innnnn-triiiiii-cate"
"LOAJ024CO","Coach","Haaaarrrrrrd tooooo aaaaavoooid","Haaaarrrrrrd tooooo aaaaavoooid"
"LOAJ025CO","Coach","...aaaaavoooid...","...aaaaavoooid..."
"LOAJ026CO","Coach","AREA ATTACK!","AREA ATTACK!"
"LOAJ027CO","Coach","Woooooo-hoooooo!","Woooooo-hoooooo!"
"LOAJ028CO","Coach","MMmm-hmmm.","MMmm-hmmm."
"LOAJ029CO","Coach","Feel the burn!","Feel the burn!"
"LOAJ030CO","Coach","Ha!","Ha!"
"LOAJ031CO","Coach","Huhhh!","Huhhh!"
"LOAJ032CO","Coach","Hup!","Hup!"
"LOAJ033CO","Coach","Hyaaa!","Hyaaa!"
"LOAJ034CO","Coach","Hap!","Hap!"
"LOAJ035CO","Coach","Hop!","Hop!"
"LOAJ036CO","Coach","Hayooo!","Hayooo!"
"LOAJ037CO","Coach","Waaaaaaah!","Waaaaaaah!"
"LOAJ038CO","Coach","And this!","And this!"
"LOAJ039CO","Coach","And that!","And that!"
"LOAJ040CO","Coach","And backwards!","And backwards!"
"LOAJ041CO","Coach","And faked you out!","And faked you out!"
"LOAJ042CO","Coach","Ha ha!","Ha ha!"
"LOAJ043CO","Coach","Ho ho!","Ho ho!"
"LOAJ044CO","Coach","Heh heh heh!","Heh heh heh!"
"LOAJ045CO","Coach","Ahhh!","Ahhh!"
"LOAJ046CO","Coach","Oooff!","Oooff!"
"LOAJ047CO","Coach","Gahhh!","Gahhh!"
"LOAJ048CO","Coach","(electrocution sounds)","(electrocution sounds)"
"LOAJ049CO","Coach","Grrr!","Grrr!"
"LOAJ050RA","Raz","Give up Coach. I'm sure the Psychonauts are on their way from HQ right now to bust you.","Give up Coach. I'm sure the Psychonauts are on their way from HQ right now to bust you."
