"id","character","origin_dialogue","translated_dialogue"
"LOAJ051CO","Coach","Sorry, but I was made senior facility officer this year, and the senior facility officer has notified HQ that everything is peachy at Camp Whispering Rock!","Sorry, but I was made senior facility officer this year, and the senior facility officer has notified HQ that everything is peachy at Camp Whispering Rock!"
"LOAK000CO","Coach","People of Lungfishopolis...","People of Lungfishopolis..."
"LOAK001CO","Coach","...I'm sorry I let you down.","...I'm sorry I let you down."
"LOAK002CO","Coach","Ggggghhh..","Ggggghhh.."
"LOAK003RA","Raz","Finally!","Finally!"
"LOAK004RA","Raz","Okay, tower. Get ready for Goggalor!","Okay, tower. Get ready for Goggalor!"
"LOAK005Z1","Zealots-1","Goggalor, you did it! You defeated Kochamara!","Goggalor, you did it! You defeated Kochamara!"
"LOAK006RA","Raz","Yep. Now we can find out where Lili went.","Yep. Now we can find out where Lili went."
"LOAK007Z1","Zealots-1","Not yet. The tower is still broadcasting its mind control over the populace!","Not yet. The tower is still broadcasting its mind control over the populace!"
"LOAK008Z1","Zealots-1","You must destroy the tower!","You must destroy the tower!"
"LOAK009RA","Raz","Right. Man, Goggalor needs a sidekick or a PA or something.","Right. Man, Goggalor needs a sidekick or a PA or something."
"LOAK010Z1","Zealots-1","Goggalor! The tower!","Goggalor! The tower!"
"LOAK011RA","Raz","Oh! Yeah! Right.","Oh! Yeah! Right."
"LOAL000RA","Raz","Well, he was evil. But he did build a lot of roads.","Well, he was evil. But he did build a lot of roads."
"LOAM000Z1","Zealots-1","Goggalor! ","Goggalor! "
"LOAM001RA","Raz","Hey, shouldn't this place be much quieter now that Kochamara's gone?","Hey, shouldn't this place be much quieter now that Kochamara's gone?"
"LOAM002Z1","Zealots-1","Well, there's still some crazy Navy guys who haven't realized that the war is over. But--we got 'em on the run I think.","Well, there's still some crazy Navy guys who haven't realized that the war is over. But--we got 'em on the run I think."
"LOAM003Z1","Zealots-1","Got some really aggressive flyers at the printer right now. Should sway popular opinion our way in no time.","Got some really aggressive flyers at the printer right now. Should sway popular opinion our way in no time."
"LOAM004RA","Raz","So you don't mind if I smash up some more tanks and planes and stuff?","So you don't mind if I smash up some more tanks and planes and stuff?"
"LOAM005Z1","Zealots-1","Goggalor, you may smash it all! This whole area is scheduled for reforestation. ","Goggalor, you may smash it all! This whole area is scheduled for reforestation. "
"LOAM006Z1","Zealots-1","Kochamara built this city for us. Lungfish weren't meant to live in cities!","Kochamara built this city for us. Lungfish weren't meant to live in cities!"
"LOAM007RA","Raz","Well, okay then. I'll bet I can save you a bit on the demolition costs.","Well, okay then. I'll bet I can save you a bit on the demolition costs."
"LOAM008Z1","Zealots-1","Yeah, go nuts! You can squish people too if you want. My family lives in a whole other town.","Yeah, go nuts! You can squish people too if you want. My family lives in a whole other town."
"LOZF000TO","System","/YButton/ Pick up Tank.","/YButton/ Pick up Tank."
"LOZE000TO","System","/YButton/ Throw Tank.","/YButton/ Throw Tank."
"LOUC001LC","Lungfish-Citizen","Hey everyone, here comes Kochamara!","Hey everyone, here comes Kochamara!"
"LOZF001TO","System","Use your PSYCHIC SHIELD to protect you from damage, and reflect SOME enemy attacks back at the attacker! NOTE: You will not be able to maintain a PSYCHIC SHIELD forever, and when this part of your mind is exhausted, you will need to wait a while before you use it again.","Use your PSYCHIC SHIELD to protect you from damage, and reflect SOME enemy attacks back at the attacker! NOTE: You will not be able to maintain a PSYCHIC SHIELD forever, and when this part of your mind is exhausted, you will need to wait a while before you use it again."
"LOAO000RA","Raz","Excellent. There it is.","Excellent. There it is."
