"Identifier","Context","Source string","Translation"
"MIAB012JT","J.T.","Um, why don't you go ask Elka? She loves to dance.","Um, why don't you go ask Elka? She loves to dance."
"MIAB013EL","Elka","You'd better back off or my boyfriend James will go nuts. He's so jealous and protective of me.","You'd better back off or my boyfriend James will go nuts. He's so jealous and protective of me."
"MIAB014CH","Chloe","Yes, teach me of your Earth rhythms.","Yes, teach me of your Earth rhythms."
"MIAB015RA","Raz","Hey, will you teach me how to dance?","Hey, will you teach me how to dance?"
"MIAB016MD","Male-Dancer","Watch and learn, kid.","Watch and learn, kid."
"MIAB017MD","Male-Dancer","Nope. Not gonna blow my high, man. I'm in my groove place.","Nope. Not gonna blow my high, man. I'm in my groove place."
"MIAC002BZ","Bobby","Ha ha! Yeah!","Ha ha! Yeah!"
"MIAC003CF","Crystal","Hi Raz!","Hi Raz!"
"MIAC004CM","Clem","Hey, there, Raz!","Hey, there, Raz!"
"MIAC005CF","Crystal","I'm sure you'll still win, Raz!","I'm sure you'll still win, Raz!"
"MIZF000TO","System","Bubble Quick-mount!","Bubble Quick-mount!"
"MIZF001TO","System","A faster way to mount the Thought Bubble is to press {AButton} while PSI Floating. Try it!","A faster way to mount the Thought Bubble is to press {AButton} while PSI Floating. Try it!"
"MIAE000MI","Milla","Razputin, darling, what are you doing back here?","Razputin, darling, what are you doing back here?"
"MIAE001RA","Raz","Uh, just came to dance. Is that okay?","Uh, just came to dance. Is that okay?"
"MIAE002MI","Milla","Of course! The party never ends in here!","Of course! The party never ends in here!"
"MIAE003MI","Milla","Roll away!","Roll away!"
"MIAE004MI","Milla","I'm going to be in another part of my mind, tending a party I'm having with some old memories, but you have fun here.","I'm going to be in another part of my mind, tending a party I'm having with some old memories, but you have fun here."
"MIAE006MI","Milla","Razputin? I... I don't really know...","Razputin? I... I don't really know..."
"MIAE007MI","Milla","I was on the dock and all of a sudden there was this... thing...","I was on the dock and all of a sudden there was this... thing..."
"MIAE008MI","Milla","And then everything went black.","And then everything went black."
"MIAE009RA","Raz","I believe you've been abducted, probably by Coach Oleander.","I believe you've been abducted, probably by Coach Oleander."
"MIAE010RA","Raz","He's trying to take over the world.","He's trying to take over the world."
"MIAE011MI","Milla","Oh, Morry.","Oh, Morry."
"MIAE012MI","Milla","Well, if you find my body, give it a little shake, will you?","Well, if you find my body, give it a little shake, will you?"
"MIAE013MI","Milla","In the mean time, you can shake it in here as much as you want!","In the mean time, you can shake it in here as much as you want!"
"MIQZ010CM","Clem","Yow!","Yow!"
"MIQZ011CF","Crystal","Ugh!","Ugh!"
"MIQZ006CP","Chops","Oof!","Уф!"
"MIZE000TO","System","Press {WhiteButton} to Levitate.","Press {WhiteButton} to Levitate."
"MIZE001TO","System","Press {AButton} to Bubble Bounce.","Press {AButton} to Bubble Bounce."
"MIZE002TO","System","Press {AButton} while airborne to Double Bubble Bounce over the gap.","Press {AButton} while airborne to Double Bubble Bounce over the gap."
"MIZE003TO","System","Bubble Bounce then press the {LeftFlipper} while airborne to float over the gap.","Bubble Bounce then press the {LeftFlipper} while airborne to float over the gap."
"MIZE004TO","System","Bubble Bounce then press {LeftFlipper} while airborne to float over the gap.","Bubble Bounce then press {LeftFlipper} while airborne to float over the gap."
"MIZE005TO","System","Press {LeftFlipper} while airborne to float.","Press {LeftFlipper} while airborne to float."
"MIZE006TO","System","Float in an updraft for extra lift.","Float in an updraft for extra lift."
"MIZE007TO","System","Respawn kickout activated! If you miss a jump, return here!","Respawn kickout activated! If you miss a jump, return here!"
"MIZE010TO","System","Best Time:","Best Time:"
"MIZE011TO","System","Your Time:","Your Time:"
"MIZB000TO","System","Levitation Learner's Permit","Levitation Learner's Permit"
"MIZE012TO","System","Press {BlackButton} to Levitate.","Press {BlackButton} to Levitate."
"MIZE013TO","System","Press {RightFlipper} to Levitate.","Press {RightFlipper} to Levitate."
"MIZE014TO","System","Reset race","Reset race"
"MIZE015TO","System","Use your Thought Bubble to map your LEVITATION power to a button on the controller.","Use your Thought Bubble to map your LEVITATION power to a button on the controller."
"MIAB018CM","Clem","Haha! Yay! Raz learned Telekinesis! Right on!","Haha! Yay! Raz learned Telekinesis! Right on!"
"MIAE014MI","Milla","That's nice, darling, but why don't you help us instead?","That's nice, darling, but why don't you help us instead?"
"MIZZ000TO","System","GO","GO"
"MIZZ001TO","System","LOSE","LOSE"
"MIZZ002TO","System","READY","READY"
"MIZZ003TO","System","SET","SET"
"MIZZ004TO","System","WIN","WIN"
"MIAB019CM","Clem","Right on, Raz! You learned firestarting! Good for you!","Right on, Raz! You learned firestarting! Good for you!"
"MIAB020CF","Crystal","Wow, you're really good at Telekinesis, Raz! That's awesome!","Wow, you're really good at Telekinesis, Raz! That's awesome!"
"MIAB021CF","Crystal","Hee hee hee! Yay! Firestarting practice! Woo!","Hee hee hee! Yay! Firestarting practice! Woo!"
"MIAB022CP","Chops","What's this all about, eh?","What's this all about, eh?"
"MIAB023CP","Chops","Careful, eh? My hair goes up in flames and we're all goners.","Careful, eh? My hair goes up in flames and we're all goners."
"MIAB024EF","Elton","Okay, I really don't like being up this high.","Okay, I really don't like being up this high."
"MIAB025EF","Elton","Oh man. I hope I don't get much hotter. That would be uncomfortable.","Oh man. I hope I don't get much hotter. That would be uncomfortable."
"MIAB026JT","J.T.","Put me down partner or I'll show you what a good shot I am!","Put me down partner or I'll show you what a good shot I am!"
"MIAB027JT","J.T.","Move along, little doggy. Nothin' to burn here.","Move along, little doggy. Nothin' to burn here."
"MIAB028EL","Elka","Hey! Grow up, Razputin!","Hey! Grow up, Razputin!"
"MIAB029EL","Elka","If you don't stop trying to burn me right now I am going to SCREAM!","If you don't stop trying to burn me right now I am going to SCREAM!"
"MIAB030CH","Chloe","Finally! I'm being TAKEN! They've finally come for me! Hey! It's just you. PUT ME DOWN!","Finally! I'm being TAKEN! They've finally come for me! Hey! It's just you. PUT ME DOWN!"
"MIAB031CH","Chloe","Hm. Atmospheric changes in effect. Adjusting helmet thermostat.","Hm. Atmospheric changes in effect. Adjusting helmet thermostat."
"MIZE016TO","System","Are you sure you want to reset the race?","Are you sure you want to reset the race?"
