identifier,labels,context,source,translation
CACO006FA,CACO,Franke,"What is it, Vernon?",
CACO007VE,CACO,Vernon,"Have you guys seen Dogen or Elka or Milka? We were playing hide-and-seek and--it's actually a funny story... I said, ""I'll count to a hundred."" and then--",
CACO008KI,CACO,Kitty,Stop! We saw them. We saw all of them. Just like five seconds ago.,
CACO009FA,CACO,Franke,"They were headed towards that place, the one that's so far away.",
CACO010VE,CACO,Vernon,The beach?,
CACO011KI,CACO,Kitty,"No, that's too close...",
CACO012KI,CACO,Kitty,The woods! The really far woods.,
CACO013VE,CACO,Vernon,Thanks!,
CABH020EF,CABH,Elton,That was rad!,
CABH022EF,CABH,Elton,"You're pretty rad, too.",
CAMO030RA,CAMO,Raz,What're you doing?,
CAMO031CH,CAMO,Chloe,"To contact anything beyond your planet's moon, we need a bigger antenna.",
CAMP032RA,CAMP,Raz,Can I help?,
CAMP033CH,CAMP,Chloe,Affirmative. Step aside and do not touch anything. And stop talking.,
CAMR002RA,CAMR,Raz,Did you find that bear?,
CAMR003MH,CAMR,Mikhail,Nyet. Soon. Woods not big enough for me and summer camp and giant bear.,
CAMS004RA,CAMS,Raz,"I saw something in the woods, too. I don't think it's a bear, Mikhail.",
CAMS005MH,CAMS,Mikhail,Agreed. Could be ape escaped from zoo or bigfoot. Same result: wrestled into submission.,
CAMT006RA,CAMT,Raz,I think it's some kind of a walking fish thing.,
CAMT007MH,CAMT,Mikhail,Fish? Is this joke? It is funny.,
CAMU008RA,CAMU,Raz,"I'm serious, Mikhail. I think that bear is a fish.",
CAMU009MH,CAMU,Mikhail,Okay. Joke is over.,
CAMU010RA,CAMU,Raz,"Hey, Mikhail, what's up?",
CAMU011MH,CAMU,Mikhail,Nothing. Busy now.,
CAPU011RA,CAPU,Raz,Great shot!,
CAPU012JT,CAPU,J.T.,"Well, pardner, it weren't ""great."" But t'weren't bad, neither.",
CAPV013RA,CAPV,Raz,"Wow, that's awesome!",
CAPV014JT,CAPV,J.T.,"Stand back, greenhorn, or yer gonna git a nasty hotfoot.",
CAAJ001BN,CAAJ,Benny,RRRRR! Lemme go!,
CAAJ002MH,CAAJ,Mikhail,What to do with small bully assistant?,
CAAJ003MF,CAAJ,Maloof,"Jeez, I don't know. Could you put him in that ""Deadly Nelson"" you were talking about?",
CAAJ004MH,CAAJ,Mikhail,"Could. On such tiny opponent, all blood might drain out earholes.",
CAAJ005BN,CAAJ,Benny,AHHHHH!,
CAAJ006MF,CAAJ,Maloof,"Shut up, Benny!",
CAAJ007MH,CAAJ,Mikhail,"On other hand, blood from constricted trunk could rush to tongue.",
CAAJ008MF,CAAJ,Maloof,And?,
CAAJ009MH,CAAJ,Mikhail,"Tongue swells, pops. Most blood drains back down throat.",
CAAJ010MF,CAAJ,Maloof,Interesting.,
CAAJ011MH,CAAJ,Mikhail,Less mess that way. Mouth stuffed with giant tongue can't scream--so quieter.,
CAAJ013MF,CAAJ,Maloof,"Shut up, Benny.",
CAAJ014MF,CAAJ,Maloof,You have something less drastic?,
CAAJ015MH,CAAJ,Mikhail,Could use Half Deadly Nelson.,
CAAJ016MF,CAAJ,Maloof,What's that?,
CAAJ017MH,CAAJ,Mikhail,Like Deadly Nelson but less dying.,
CAAJ018MF,CAAJ,Maloof,How much less?,
CAAJ019MH,CAAJ,Mikhail,Half.,
CAAJ020MF,CAAJ,Maloof,What happens the other half of the time?,
CAAJ021MH,CAAJ,Mikhail,"Opponent lives, spends rest of short life praying for death.",
CAAJ022BN,CAAJ,Benny,HEY! Can you hear me down there? Maloof?,
CAAJ024BN,CAAJ,Benny,"Seriously, Maloof, I apologize. Call off your goon and I'll never bother you again. Ever.",
CAAJ025MF,CAAJ,Maloof,"The thing is, Benny, you're never gonna bother me again either way.",
CAAJ026MF,CAAJ,Maloof,So you're gonna have to offer something a lot better than that.,
CAAJ027BN,CAAJ,Benny,Like what?,
CAAJ028MF,CAAJ,Maloof,"Any ideas, Mikhail?",
CAAJ029MH,CAAJ,Mikhail,"Know anything about giant, hairless bear?",
CAAJ030BN,CAAJ,Benny,No...,
CAAJ031MH,CAAJ,Mikhail,Out of ideas. Preparing Nelson.,
CAAJ032BN,CAAJ,Benny,"Well wait! Wait! Uh, maybe--uh, yeah, m--maybe I did see something like that. Give me a minute to think.",
CAAJ033MF,CAAJ,Maloof,"You ready to talk, Benny?",
CAAJ034BN,CAAJ,Benny,Hold on. It'll come to me.,
CAAK035MF,CAAK,Maloof,"Hey, Raz. You mind coming back later? We're taking care of a little business.",
CAAO001VE,CAAO,Vernon,Did you ladies know one of the bloodiest battles of the Civil War was fought on the shore of this very lake?,
CAAO002VE,CAAO,Vernon,"Yup, it's true.",
CAAO003VE,CAAO,Vernon,It happened back when this place was still an Indian summer camp and burial ground.,
CAAO004VE,CAAO,Vernon,A group of Union soldiers got separated from their regiment.,
CAAO005VE,CAAO,Vernon,Night was falling and they were cold and scared... Of Dracula! BOO! Huh-hahaha!,
CAAO006VE,CAAO,Vernon,"Uhm, I'm kidding. They were just terrified of getting shot.",
CAAO007VE,CAAO,Vernon,Though I'm sure any of them with any sense were afraid of Dracula too.,
CAAO008VE,CAAO,Vernon,They stumbled across an old building--you can still see it on the far side of the lake.,
CAAO009VE,CAAO,Vernon,So they decided to spend the night there.,
CAAO010VE,CAAO,Vernon,Little did they know it was...,
CAAO011VE,CAAO,Vernon,An abandoned Indian insane asylum built on a caveman burial ground!,
CAAO012VE,CAAO,Vernon,Little did they also know that a cursed fish lived in the asylum.,
CAAO013VE,CAAO,Vernon,And that he was an escaped lunatic.,
CAAO014VE,CAAO,Vernon,But from a different asylum.,
CAAO015VE,CAAO,Vernon,"So even though he was actually living in an asylum, he was still counted as escaped.",
CAAO016VE,CAAO,Vernon,And what was his curse you ask?,
CAAO017VE,CAAO,Vernon,Where his gills should have been...,
CAAO018VE,CAAO,Vernon,He. Had. Hooks!,
CAAO019VE,CAAO,Vernon,"Yup, and where one of the hooks should have been...",
CAAO020VE,CAAO,Vernon,He. Had. A. Lung! Yup... a lung!,
CAAO021VE,CAAO,Vernon,And instead of being about fourteen inches long.,
CAAO022VE,CAAO,Vernon,He. Was. Ten. Feet. Tall.,
CAAO023VE,CAAO,Vernon,But that wasn't the scariest thing.,
CAAO024VE,CAAO,Vernon,The scariest thing...,
CAAO025VE,CAAO,Vernon,The absolute scariest thing...,
CAAO026VE,CAAO,Vernon,And the thing that still makes the old timers' blood turn to ice and vice versa...,
CAAO027VE,CAAO,Vernon,Is the part I said first about how he had hooks for gills.,
CAAO028VE,CAAO,Vernon,Oh Brrrrrr.,
CAAO029VE,CAAO,Vernon,"Uh, anybody need a hug?",
CAAO030VE,CAAO,Vernon,Anybody?,
CAAO031VE,CAAO,Vernon,No?,
CAAO032VE,CAAO,Vernon,"Okay, then. Anybody mind if I tell that story again?",
CAAO033VE,CAAO,Vernon,Speak up now if you don't want to hear it again.,
CAAO034VE,CAAO,Vernon,Here we go...,
CAAP035VE,CAAP,Vernon,"Not now, Raz, I'm in the middle of a story.",
CABB001FA,CABB,Franke,TeeeVeee.,
CABB002KI,CABB,Kitty,Hackey saaaaaack...,
CABB003VE,CABB,Vernon,"Yesss, hackey saaaack.",
CABB004RA,CABB,Raz,Oh no! They're all brainless!,
CABB005VE,CABB,Vernon,Hi Raz!,
CABB006RA,CABB,Raz,Vernon! You're okay!,
CABB007VE,CABB,Vernon,"Yeah, we're great. Me and my pals Kitty and Franke are just hanging out tellin' stories and watchin' the boob tube.",
CABB008KI,CABB,Kitty,TeeeVeeeee.,
CABB009RA,CABB,Raz,"Vernon, look at them. They're zombies.",
CABB010VE,CABB,Vernon,It did seem kind of weird when they let me get this close to them.,
CABB011VE,CABB,Vernon,And then they didn't mind when I talked all through the show.,
CABB012VE,CABB,Vernon,Kitty even agreed to go on a date with me more or less--we're gonna play hackey sack!,
CABB013RA,CABB,Raz,Keep an eye on them Vernon.,
CABB014RA,CABB,Raz,I'm gonna go figure out what's causing this!,
CABB015VE,CABB,Vernon,"Roger that, Raz.",
CABE001EL,CABE,Elka,"I don't care how long you two have been ""pardners."" James is my boyfriend now. Do you know what that means?",
CABE002CP,CABE,Chops,"Uh, well, he wears his good parade chaps a lot more.",
CABE003EL,CABE,Elka,"Yes, he's less filthy. That's part of it.",
CABE004EL,CABE,Elka,But the biggest change is that he can't possibly waste as much time as he used to hanging out with his loser friends.,
CABE005CP,CABE,Chops,I don't like you.,
CABE006EL,CABE,Elka,And I don't like you. So that covers everything we have in common.,
CABE007EL,CABE,Elka,Now for the differences: I'm going to be with James all the time from now on.,
CABE008EL,CABE,Elka,You're going to have to stay as far away from us as possible or I'm going to make your life more miserable than I imagine it already is.,
CABF009LI,CABF,Lili,"I can't quite make it out, but something... something coming out of those speakers reminds me of my nightmare.",
CABF200RA,CABF,Raz,What are you listening to?,
CABG010NI,CABG,Nils,"You know Chloe, for a chick whose face I can't see because she's always wearing a helmet, you're pretty cute.",
CABG011CH,CABG,Chloe,"I'm not human, earth primate.",
CABG012NI,CABG,Nils,"But you are the girl model of whatever it is you are, right?",
CABG013CH,CABG,Chloe,Affirmative.,
CABG014NI,CABG,Nils,"At this point, that's totally close enough.",
CABG015BZ,CABG,Bobby,"Man, what smells like butt? Oh, hey Nils.  How 'bout you and your butt and its odor take a hike before I puke?",
CABG016NI,CABG,Nils,But...,
CABG017BZ,CABG,Bobby,It'd be a real shame if you had to leave your butt here because it was anchored to my foot. NOW BEAT IT!,
CABG018BZ,CABG,Bobby,"Hi Chloe.  How's it... I mean... You know, what's up and stuff?",
CABG019CH,CABG,Chloe,"Bobby, we need to work on you a little.",
CAMF001CF,CAMF,Crystal,So this is it.,
CAMF002CM,CAMF,Clem,Yep.,
CAMF003CF,CAMF,Crystal,I'm so happy Clem.,
CAMF004CM,CAMF,Clem,"Me too, Crystal.",
CAMF005CF,CAMF,Crystal,It's going to be great isn't it?,
CAMF006CM,CAMF,Clem,Super great.,
CAMF007CF,CAMF,Crystal,"We're going to be so powerful, aren't we?",
CAMF008CM,CAMF,Clem,More powerful than you can imagine.,
CAMF009CF,CAMF,Crystal,Sigh. I can't wait.,
CAMF010CF,CAMF,Crystal,"The sunset's beautiful, isn't it?",
CAMF011CM,CAMF,Clem,It will be more beautiful afterwards.,
CAMF012CF,CAMF,Crystal,When we've done what we're going to do.,
CAMF013CM,CAMF,Clem,Yes. When we've finished the project.,
CAMF014CF,CAMF,Crystal,"The people down there look like ants, don't they?",
CAMF015CM,CAMF,Clem,"They are ants, Crystal. Cruel, cruel little ants.",
CAMF016CF,CAMF,Crystal,"Oh, Clem. It's not their fault.",
CAMF017CM,CAMF,Clem,"Still, they're gonna be sorry.",
CAMF018CF,CAMF,Crystal,"Yes, that's true. They will all be sorry.",
CAMF019CF,CAMF,Crystal,Hey is that Nils down there with Chloe?,
CAMF020CM,CAMF,Clem,Whoa. That's weird.,
CAMF021CF,CAMF,Crystal,"Oh, man. I've got to tell Elka.",
CAMF022CM,CAMF,Clem,What's the point?,
CAMF023CF,CAMF,Crystal,"I guess soon there won't be much point to any of this, will there?",
CAMF024CM,CAMF,Clem,Not when we've finished...,
CAMF025CF,CAMF,Crystal,The project.,
CAMF026CM,CAMF,Clem,Yes.,
CAMF027CF,CAMF,Crystal,You hear about Elton and Milka?,
CAMF028CM,CAMF,Clem,"No, what?",
CAMF029CF,CAMF,Crystal,Totally a couple now.,
CAMF030CM,CAMF,Clem,No way. I thought Elton loved Lili?,
CAMF031CF,CAMF,Crystal,"Shyeah, well, and I thought Milka loved Quentin.",
CAMF032CM,CAMF,Clem,"Well, I guess if peoples' love was something you could trust, we wouldn't be here now, would we?",
CAMF033CF,CAMF,Crystal,"Good point as always, Clem.",
CAMF034CM,CAMF,Clem,"Well, are you ready?",
CAMF035CF,CAMF,Crystal,Just one more minute.,
CAMF036CF,CAMF,Crystal,Let's just watch the sun until it sets.,
CAMF037CM,CAMF,Clem,All right. Let's let people have one last sunset before things change forever.,
CAMF038CF,CAMF,Crystal,...forever...,
CAMG039RA,CAMG,Raz,Hey did I hear you guy's writing another cheer?,
CAMG040CF,CAMG,Crystal,Um...,
CAMG041CM,CAMG,Clem,Yessiree.,
CAMG043CM,CAMG,Clem,It's a SECRET cheer!,
CAMG044CF,CAMG,Crystal,Yeah! Super secret!,
CAMG045CM,CAMG,Clem,"But soon, you'll hear it!",
CAMG046CF,CAMG,Crystal,It will be on everybody's lips!,
CAMG047CM,CAMG,Clem,It'll be the talk of the town!,
CAMG048RA,CAMG,Raz,"Hm. Uh, okay. I guess I'll just wait for it's big debut.",
CAMG049CM,CAMG,Clem,Yes. The big debut. It's going to be great!,
CAMG050CF,CAMG,Crystal,THE GREATEST EVER!!!,
CAMG051CM,CAMG,Clem,See you later.,
CAMG052CF,CAMG,Crystal,Bye!,
CAMH053RA,CAMH,Raz,Hey is that new secret cheer done yet?,
CAMH055CM,CAMH,Clem,Sundown. We're going to debut it at sundown.,
CAMH056CF,CAMH,Crystal,"Yeah, don't worry. You'll hear about it!",
CAPW015RA,CAPW,Raz,"What's going on, JT?",
CAPW016JT,CAPW,J.T.,"Gosh darnit, flannel mouth, I'm tryin' to hear what them two's sayin'.",
CAAB002FO,CAAB,Ford,Enjoy!,
CAAC003FO,CAAC,Ford,"Yeah, yeah, see ya later",
CAAF042EL,CAAF,Elka,"Hey nosy, how 'bout pulling your big beak out of our private business?",
CAAF043EL,CAAF,Elka,"Hey, butt out!",
CAAL036MH,CAAL,Mikhail,"Can't lurk forever, bear",
CAJI001FO,CAJI,Ford,"Mmm. An eager one. Eager to learn, I wonder? Or just eager to play?",
CAJI002RA,CAJI,Raz,"Sir, I am here to learn, sir!",
CAJI003FO,CAJI,Ford,You're here to train hard?  Hmmm?,
CAJI004RA,CAJI,Raz,Yes sir!,
CAJI005FO,CAJI,Ford,Develop a skill?,
CAJI007FO,CAJI,Ford,To become part of a noble team?,
CAJI008RA,CAJI,Raz,Yes--,
CAJI009FO,CAJI,Ford,"Yes, to become...",
CAJI010RA,CAJI,Raz,Yes!,
CAJI011FO,CAJI,Ford,...a janitor!,
CAJI012RA,CAJI,Raz,No. What? I'm here to be a Psychonaut!,
CAJI013FO,CAJI,Ford,"Oh, fft!",
CAJI014FO,CAJI,Ford,"Oh, the brainy jubjub goes on upstairs.",
CAJI017FO,CAJI,Ford,"Down here it's pushin' brooms, not bendin' spoons!",
CAJI018FO,CAJI,Ford,Heh heh.,
CAJI019RA,CAJI,Raz,"Hey, Mr. Cruller, do you know where Sasha's Nein's lab is?",
CAJI020FO,CAJI,Ford,What? Huh? Secret underground lab? I don't have a secret underground lab! That's hobgoberish!,
CAJI021FO,CAJI,Ford,Now beat it! Git!,
CAJI022FO,CAJI,Ford,Stop staring at my mops!,
CAMD001RA,CAMD,Raz,Agent Vodello! I have been ordered to report here for Levitation training!,
CAMD003RA,CAMD,Raz,"I've already done the Coach's obstacle course, and Sasha showed me how to shoot!",
CAMD005RA,CAMD,Raz,Agent Nein said you were the most powerful levitator the Psychonauts had.,
CAMD009RA,CAMD,Raz,It's gotta be today! My parents come tomorrow!,
CAMD015RA,CAMD,Raz,"Well you know, I only work with the best teachers.",
CAMQ001RA,CAMQ,Raz,"Jeez, what's going on?",
CANB072RA,CANB,Raz,This way to Lake Oblongata.,
CANB073RA,CANB,Raz,It says the Main Lodge is this way.,
CANB074RA,CANB,Raz,"Basic Braining Today, 0600 hours, Coach Oleander's Classroom.",
CANB075RA,CANB,Raz,Geodesic Psycho-Isolation Chamber. Stay out!,
CANB076RA,CANB,Raz,It looks like it points to the campfire area.,
CANC001RA,CANC,Raz,What're you guys doing?,
CANC002BZ,CANC,Bobby,"Beat it, new kid.",
CAND003RA,CAND,Raz,What's that round thing up on the dock?,
CAND004BZ,CAND,Bobby,"That thing? Oh, man, lemme tell you about that thing. That thing is... none of your stinkin' business.",
CANE005RA,CANE,Raz,Mind if I scoot by?,
CANE006BZ,CANE,Bobby,Not if you don't mind my fist scooting into your neck.,
CANF007RA,CANF,Raz,Do you know where I'm supposed to be?,
CANF008BZ,CANF,Bobby,"If you bother us again, you're gonna be on a helicopter getting life-flighted to the hospital.",
CANG009RA,CANG,Raz,I don't think you guys are so tough.,
CANG010BZ,CANG,Bobby,"Why don't you try me, Goggle-girl?",
CAOA001RA,CAOA,Raz,"Hey, Mr. Cruller. Can I take out a canoe?",
CAOA002FO,CAOA,Ford,Mr. Who?,
CAOA003FO,CAOA,Ford,"You WILL call me Admiral, son. And, no, you can't charter a vessel.",
CAOA004FO,CAOA,Ford,Not without an Oarsman's Badge!,
CAOB005RA,CAOB,Raz,"Excuse me, Admiral?",
CAOB006FO,CAOB,Ford,Eh?,
CAOB007RA,CAOB,Raz,Where can I get an Oarsman's Badge? I'd really like to take out a canoe.,
CAOB008FO,CAOB,Ford,Gotta get it from one of the official camp counselors. I can't have just anybody in my fleet.,
CAOC009RA,CAOC,Raz,"Check it out, Admiral! I'm an Oarsman, First Class!",
CAOC010FO,CAOC,Ford,"Hey, it looks like all those weeks in the canoe simulator really paid off!",
CAOC011RA,CAOC,Raz,"Uh, yessir, Admiral, sir!",
CAOC012FO,CAOC,Ford,"Well, let's get you afloat!",
CAOD013RA,CAOD,Raz,"Uh, Admiral, where's that canoe again?",
CAOD014FO,CAOD,Ford,"Can't find the ship, eh? Well, well, you're not off to a promising start, Seaman.",
CAOD015FO,CAOD,Ford,"It's right outside. You can't miss it. Well, most people couldn't miss it.",
CAOU003RA,CAOU,Raz,"Excuse me, Mr. Ranger, but I'm looking for Sasha Nein's lab?",
CAOU004FO,CAOU,Ford,"Well, now even if I knew where it was, and if it were down here, and even if you were very, very close to it right now, you shouldn't be poking around here!",
CAOU005FO,CAOU,Ford,This forest is off limits!,
CAOU006FO,CAOU,Ford,Now git!,
CAOV007RA,CAOV,Raz,"Excuse me, Mr. Ranger, but I'm looking for Milla Vodello's Levitation class?",
CAOV008FO,CAOV,Ford,"She teaches out on the docks, in the sunshine, where young kids should be spending their summers! Not here in the forests!",
CAOV009FO,CAOV,Ford,"Which, have I mentioned, are off limits?",
CAOW011RA,CAOW,Raz,"Hey, I can levitate. Want to see my merit badge?",
CAOW012FO,CAOW,Ford,"Uh, that's great! You can just float up on out of this forest then!",
CAOW013FO,CAOW,Ford,Because the forest? It's off limits!,
CAPA002FO,CAPA,Ford,I-I told ya! Get up that big tree over yonder and get into Coach Oleander's class so he can start tormenting ya!,
CAPB003RA,CAPB,Raz,"So, you don't know where Sasha's lab is?",
CAPB004FO,CAPB,Ford,"I told ya, I ain't got no secret lab!",
CAPB005FO,CAPB,Ford,"Oh, that German fella?",
CAPB006FO,CAPB,Ford,Oh he's dug in under the GPC over there.,
CAPC007RA,CAPC,Raz,...I'm learning some advanced techniques from Sasha Nein right now.,
CAPC008FO,CAPC,Ford,You ever clean out a jailhouse bathroom with nothing but a pair of underwear and three bottles of diet lemonade?,
CAPC009RA,CAPC,Raz,Yes.,
CAPC010RA,CAPC,Raz,Maybe.,
CAPC011RA,CAPC,Raz,No.,
CAPC012FO,CAPC,Ford,That's a REAL advanced technique.,
CAPC013FO,CAPC,Ford,You let me know when you're done with your little zippy-zappy head games and we'll get ya to some extreme mopping. Okay?,
CAPD014RA,CAPD,Raz,"Hey, wanna see me shoot something?",
CAPD015FO,CAPD,Ford,Ya wanna see me wring your neck like a mop?,
CAPD017FO,CAPD,Ford,"Ah, dang.",
CAPE018RA,CAPE,Raz,...I'm learning Levitation!,
CAPE019FO,CAPE,Ford,"Now, you go take a canoe out to that pretty lady in the lake, if you wanna start flying around like a crazy person.",
CAPE020FO,CAPE,Ford,The only thing I use bubbles for here is moppin'!,
CAPF021RA,CAPF,Raz,"Hey, Mr. Cruller! I'm a trained Levitator now!",
CAPF022RA,CAPF,Raz,"You have to admit, that would come in handy to clean those high up type places.",
CAPF023FO,CAPF,Ford,Ahh-Ffft! I could go up to the store in the main lodge and buy a Cobweb Duster that would do the same thing.,
CAPF024FO,CAPF,Ford,Levitation!,
CAPG025RA,CAPG,Raz,Mr. Cruller?,
CAPG026FO,CAPG,Ford,"Ah, so you're finally ready to begin your janitor training! Hmmm?",
CAPG027RA,CAPG,Raz,"Um, almost, but as a practice for that...",
CAPO003RA,CAPO,Raz,Where did you--,
CAPO004FO,CAPO,Ford,Under the GPC! Maybe it's your ears I should be moppin'!,
CAPO005RA,CAPO,Raz,I'm learning some advanced techniques from Sasha Nein right now.,
CAPO006FO,CAPO,Ford,You let me know when you're done with the little zippy-zappy head games and we'll get to some extra mopping. Okay?,
CAPO007RA,CAPO,Raz,"Hey, wanna watch me shoot something?",
CAPO008FO,CAPO,Ford,You wanna see me wring your neck like a mop?,
CAPO009RA,CAPO,Raz,"Hey, after I learn Levitation, I could maybe help you get up to higher places to clean.",
CAPO010FO,CAPO,Ford,"Now, that's the first sensible thing you've said all day.",
CAPQ003RA,CAPQ,Raz,That's really catchy!,
CAPQ004CP,CAPQ,Chops,"Thanks a lot, man.",
CAPR005RA,CAPR,Raz,You guys are excellent!,
CAPR006JT,CAPR,J.T.,Mighty kind of you to say.,
CAPS007RA,CAPS,Raz,Wow. Sweet!,
CAPS008JT,CAPS,J.T.,Glad ya like it.,
CAPT009RA,CAPT,Raz,"Seriously, you guys really sound good.",
CAPT010JT,CAPT,J.T.,"Doggone it, Raz, we're tryin' to play here.",
CAPX001RA,CAPX,Raz,Whatcha doin' there?,
CAPX002KI,CAPX,Kitty,"We're making friendship bracelets. You know, for our ""friends.""",
CAPY003RA,CAPY,Raz,"Hey, is that my name on that one?",
CAPY004KI,CAPY,Kitty,Not unless your name is Franke. Or Kitty.,
CAPZ005RA,CAPZ,Raz,"Oh, I guess I saw an ""R"" and... and an ""A""...",
CAPZ006KI,CAPZ,Kitty,"What's your name again, kid? Spaz?",
CAQA007RA,CAQA,Raz,My name's Raz.,
CAQA008KI,CAQA,Kitty,"Well, Spaz, why don't you go bother someone else.",
CAQB009RA,CAQB,Raz,Can I ask you guys a question?,
CAQB010KI,CAQB,Kitty,Ummmm... hmmmm... no.,
CAQC001RA,CAQC,Raz,"Hey Maloof, can I join in?",
CAQC002MF,CAQC,Maloof,"Sorry, Raz. This our thing.",
CAQD003RA,CAQD,Raz,"Come on, Maloof, give me a chance.",
CAQD004MF,CAQD,Maloof,You're a nice circus boy. You don't want to get mixed up in our business.,
CAQE005RA,CAQE,Raz,I just wanted to play too.,
CAQE006MF,CAQE,Maloof,Someday--and that day may never come--I will call upon you to toss me a ball or build a fort out of refrigerator boxes.,
CAQF007RA,CAQF,Raz,Hey--,
CAQF008MF,CAQF,Maloof,"I have a sentimental weakness for you, Raz. But you talk when you should listen.",
CAQG001RA,CAQG,Raz,"Hey Vernon, what's up?",
CAQG002VE,CAQG,Vernon,"I'm looking for Dogen, Elka, and Milka.",
CAQH003RA,CAQH,Raz,"Any luck finding those guys, Vernon?",
CAQH004VE,CAQH,Vernon,"Nope, not yet.",
CAQI001RA,CAQI,Raz,Excuse me--,
CAQI002FO,CAQI,Ford,I told you them burgers ain't ready!!!,
CAQI003RA,CAQI,Raz,"Uh, no you didn't.",
CAQI004FO,CAQI,Ford,The coals ain't hot! They're not going to be done for a while. Maybe a week.,
CAQI005RA,CAQI,Raz,A week?,
CAQI006FO,CAQI,Ford,They're backordered. I'm the only one back here! These things take time.,
CAQI007RA,CAQI,Raz,I don't even want a hamburger!,
CAQI008FO,CAQI,Ford,"Oh, well why didn't you say so?",
CAQI009FO,CAQI,Ford,So what DO you want?,
CAQJ010RA,CAQJ,Raz,"Hey, where's my hamburger?",
CAQJ011FO,CAQJ,Ford,Grrr! I told you--,
CAQJ012RA,CAQJ,Raz,Just kidding! I just want to buy stuff.,
CAQJ013FO,CAQJ,Ford,"Don't push me, Sonny. I can reach you with this spatula.",
CAQK014RA,CAQK,Raz,"Hey, anything new in the store?",
CAQK015FO,CAQK,Ford,Take a look.,
CAQL016FO,CAQL,Ford,Now leave me alone. I'm cooking!,
CAQM001RA,CAQM,Raz,"Hey, how'd you get out here?",
CAQM002FO,CAQM,Ford,I'm supposed to be here! I'm the Ranger!,
CAQM003FO,CAQM,Ford,"You're the one who shouldn't be out here, Sonny.",
CAQM004FO,CAQM,Ford,"This part of the woods is, uh... its not normal, see. Not safe.",
CAQM005FO,CAQM,Ford,I've seen some things... ohhh... and I've heard some things...,
CAQM006FO,CAQM,Ford,Like that? Ya hear that?,
CAQM007FO,CAQM,Ford,Now get yourself up to the main lodge and stay by the fire where it's safe.,
CAQU001FO,CAQU,Ford,Finest of the fleet!,
CAQU002RA,CAQU,Raz,"I'll take good care of her, sir!",
CAQU003FO,CAQU,Ford,Now don't take 'er out too far!,
CAQU004FO,CAQU,Ford,"That lake isn't as peaceful or as harmless as she looks, mm-hmm...",
CAQV002RA,CAQV,Raz,Aren't you guys going to Coach Oleander's class?,
CAQV003PH,CAQV,Phoebe,Are you kidding? A kid got killed in that class last year.,
CAQV004QU,CAQV,Quentin,"I heard it was a bunch of kids, Phoebe.",
CAQV005PH,CAQV,Phoebe,"Well, I heard it was a bunch of blind kids, and the Coach threw 'em off a cliff.",
CAQV006QU,CAQV,Quentin,Yeah... because they were late for class.,
CAQV007PH,CAQV,Phoebe,"You'd better hurry, kid! Now, where were we, Quentin?",
CAQX014FO,CAQX,Ford,Hey! No playin' hooky on my watch!  Ehhh.,
CAQX015FO,CAQX,Ford,Class is the other way! Now git!,
CAQY002RA,CAQY,Raz,Boyfriend? *Boyfriend?*,
CAQZ004DO,CAQZ,Dogen,Owwwwww.,
CAQZ005JT,CAQZ,J.T.,Ugh!,
CAQZ006CP,CAQZ,Chops,Oof!,
CAQZ007EL,CAQZ,Elka,Yow!,
CALF010SA,CALF,Sasha,I had no idea you were at such a remedial level.,
CALF011RA,CALF,Raz,Hey!,
CALF012SA,CALF,Sasha,"Lucky for you, we have one of the world's foremost levitators on staff.",
CALF013RA,CALF,Raz,"Agent Milla Vodello, the Mental Minx!",
CALF014SA,CALF,Sasha,Precisely. You'll need this Oarsman's Badge to reach her at the docks.,
CALF015SA,CALF,Sasha,I'll try to determine where this interference is coming from.,
CALF016SA,CALF,Sasha,Return when you've earned your Levitation Merit Badge.,
CALF018RA,CALF,Raz,But I have to climb that creepy tower and save Dogen from an insane dentist!,
CALF019SA,CALF,Sasha,Patience Razputin. Go see Milla at the docks and perhaps we will get to the top of that tower... and the bottom of your nightmare.,
CACM140PH,CACM,Phoebe,"Dude, you're grossing me out.",
CAMX030CO,CAMX,Coach,Ughhh.,
CAMX026CO,CAMX,Coach,"Uhhh.  Step away, soldier.",
CAMX027CO,CAMX,Coach,"Back off, soldier!",
CAMX028CO,CAMX,Coach,"Leave me alone, Private!",
CAMX029CO,CAMX,Coach,"Get out of my face, soldier!",
CAMX032CO,CAMX,Coach,Hhhuuuhhh.,
CAMX033CO,CAMX,Coach,Will you shut up!,
CACE096PH,CACE,Phoebe,(Sigh) Dude.,
CABY047QU,CABY,Quentin,"No way, you're the best.  That was good.",
CAAW000DO,CAAW,Dogen,"I'm telling you for the last time, no!",
CAAW001DO,CAAW,Dogen,I would never do that. I could never...,
CAAW002DO,CAAW,Dogen,...KILL EVERYONE.,
CAAW003DO,CAAW,Dogen,Oh... hi Raz!,
CAAW004RA,CAAW,Raz,Squirrel trouble?,
CAAW005DO,CAAW,Dogen,"They're liars is all. Whatever they tell you, it's a lie.",
CAAW006RA,CAAW,Raz,I'll take your word for it.,
CAAW007RA,CAAW,Raz,You going to class?,
CAAW008DO,CAAW,Dogen,"Yeah, I'll meet you up there. As soon as I get these guys to shut up!",
CAAY000RA,CAAY,Raz,"Hey, why aren't you guys in Coach Oleander's class?",
CACP000LI,CACP,Lili,Why don't you take a picture. It'll last longer.,
CACP001RA,CACP,Raz,Whoops. Sorry.,
CACQ000RA,CACQ,Raz,"Hey, where you going, Maloof?",
CACQ001MF,CACQ,Maloof,Shhhh! I snuck out. That class is a death trap for crazy people!,
CACQ002MF,CACQ,Maloof,"Listen, the Coach is strong. At the start of class he pulls you into his mind, and then there's nothing you can do about it.",
CACQ003MF,CACQ,Maloof,"But once you're in, you can use these Smelling Salts to sneak out.",
CACQ004MF,CACQ,Maloof,"Take mine. I don't need them anymore. I'm calling my parents to come get me, before I get hurt.",
CACQ005BZ,CACQ,Bobby,Too late!,
CACQ006MF,CACQ,Maloof,Bobby! Ahh!,
CACQ007BZ,CACQ,Bobby,"Hey, kid. You owe me five arrowheads for this week's protection service. ",
