identifier,labels,context,source,translation
CACQ008BN,CACQ,Benny,"Cough it up, Ma-loser, or you'll be coughing up bloody tears.",
CACQ009RA,CACQ,Raz,"Hey, leave him alone.",
CACQ010BZ,CACQ,Bobby,"I heard a rumor that you were raised in the circus. Well, let me put this in terms you'll understand. I'm the Strong Man around here.",
CACQ011RA,CACQ,Raz,Really? Because you look more like the cotton candy.,
CACQ012BZ,CACQ,Bobby,(Gasp!),
CACQ013BZ,CACQ,Bobby,"Benny, put this kid's death on my to-do list.",
CACQ014BN,CACQ,Benny,"Come on, we'll see him in class.",
CACQ015BZ,CACQ,Bobby,"Yeah, we'll settle this on the battlefield.",
CACR000FO,CACR,Ford,Nuh-uh! ,
CACR001FO,CACR,Ford,I told you!,
CACR002FO,CACR,Ford,"The rest of camp is off limits, until you have a Basic Braining Merit Badge.",
CACS000RA,CACS,Raz,"You know where this button is from, Coach?",
CACS001CO,CACS,Coach,"Hey, you stole a button from the Geodesic Psychoisolation Chamber! ",
CACS002RA,CACS,Raz,"No, I didn't! I--Bobby Zilch gave it to me.",
CACS003CO,CACS,Coach,Shoulda known. That kid spends more time in the cooler than in school.  ,
CACS004CO,CACS,Coach,Reminds me of myself when I was his age.,
CACS005CO,CACS,Coach,"Well, go put it back!",
CADY000RA,CADY,Raz,Find 'em yet?,
CACS007RA,CACS,Raz,"Hey, Coach. Where IS the G--",
CACS008CO,CACS,Coach,Don't you know how to use your map?,
CACS009RA,CACS,Raz,Right! Yes! Sorry!,
CAZE003TO,CAZE,System,Press /JournalButton/ to access JOURNAL and MAP.,
CACS011RA,CACS,Raz,"Hey, if you have one of these buttons too, we could play tiddlywinks.",
CACS012CO,CACS,Coach,"If I had one of those buttons, I could kill you with it in six seconds.",
CACT000VE,CACT,Vernon,I'm hunting the most dangerous prey of all. ,
CACT001VE,CACT,Vernon,MAN.,
CACU000RA,CACU,Raz,This button look familiar to you?,
CACU001VE,CACU,Vernon,"Oh, man. That's from the Geodesic Psychoisolation Chamber. That reminds me of this time I was stuck in there for three days straight. The first ten minutes weren't bad, but then the second five were pretty scary. I was delirious for the three after that. And then--",
CACU002RA,CACU,Raz,"Hey, I think I see Elka over there!",
CACU003VE,CACU,Vernon,Where?,
CACV000RA,CACV,Raz,I think this button is a clue to the location of Sasha Nein's secret lab.,
CACV001NI,CACV,Nils,Really? Hang on. I'll use my power of Clairvoyance on it to see if he's got any ladies in there.,
CACV002NI,CACV,Nils,Nope. Just Maloof. And he's crying. I've heard that's what happens to kids who go for Sasha's advanced training too early.,
CACX000RA,CACX,Raz,"Hey, Dogen! I got a secret for you.",
CACX001RA,CACX,Raz,(...whisper-whisper...),
CACX002RA,CACX,Raz,...Nils...,
CACX004EL,CACX,Elka,"Hey, not fair! Whispering is so rude!",
CACX005EL,CACX,Elka,"What did he tell you, Dogen?",
CACY000RA,CACY,Raz,"Hey, look at this button I found on Nils' bunk.",
CACY001RA,CACY,Raz,It looks like it came off a girl's dress.,
CACY003EL,CACY,Elka,I don't care.,
CACY004RA,CACY,Raz,Looks like it was just torn off by force!,
CACY005RA,CACY,Raz,It's got little teeth marks on it!,
CACY006EL,CACY,Elka,GET THAT THING OUT OF MY FACE BEFORE I SHOVE IT IN YOUR EYE SOCKET AND SEW IT TO YOUR BRAIN!,
CACY007DO,CACY,Dogen,Nils kisses girls on the mouth and likes it.,
CACY008EL,CACY,Elka,"Why don't you just take off your hat and kill me, Dogen?",
CACY009DO,CACY,Dogen,I dunno.,
CACZ000RA,CACZ,Raz,But I need to get to Sasha Nein's secret lab!,
CADA000RA,CADA,Raz,"Where'd you get your clothes? Because my sister, she's kind of fat and she has so much trouble finding good stuff.",
CADA001KI,CADA,Kitty,WHAT?,
CADA002RA,CADA,Raz,"I said, do you know where Sasha's secret lab is?",
CADA003FA,CADA,Franke,"Why don't you go talk to someone who likes you, and leave us alone?",
CADB000RA,CADB,Raz,"Hey, look. I got a button. Can I join your little craft club?",
CADB001FA,CADB,Franke,"Hey, look. I got an ugly face. Can I join your ugly club?",
CADB002KI,CADB,Kitty,"Uh, Franke. Let me handle the insults, okay?",
CADB003KI,CADB,Kitty,"Hey, look! My Dad's poor and I was raised in the circus. Can I join the Psychonauts?",
CADB005FA,CADB,Franke,"Dang, Kitty. You're the best!",
CADB006RA,CADB,Raz,"Hey, look. I got a button. Everybody says you guys suck.",
CADC000RA,CADC,Raz,"Hey, I got this button from Sasha Nein, and I have to give it back. Do you know where his secret lab is?",
CADC001MH,CADC,Mikhail,Do not know. Why not ask foxy girlfriend over there?,
CADC002RA,CADC,Raz,Again with the girlfriend thing. Listen--,
CADC003MH,CADC,Mikhail,"Hey, just kidding. Mikhail know women good for only one thing!",
CADC005MH,CADC,Mikhail,Unless have skinny arms like your girlfriend. Then out of luck.,
CADD000RA,CADD,Raz,"Hey, who is that?",
CADD001MF,CADD,Maloof,Raz is that you? It's me! Maloof!,
CADD002RA,CADD,Raz,"Hang on, buddy. Give me a sec to pop this tin can.",
CADD003MF,CADD,Maloof,Thanks! I thought I was going to have to eat my own arm.,
CADD004RA,CADD,Raz,"Okay, this is dumb. There's no way I can break open that big, steel hut with this little button.",
CADE000RA,CADE,Raz,"Hey, Lili. Do you know where Sasha Nein's secret lab is? ",
CADE001LI,CADE,Lili,"Secret? It's printed on your map, duh!",
CADE002RA,CADE,Raz,"Oh, I knew that. I was just curious if YOU knew where Sasha Nein's lab was.",
CADE003RA,CADE,Raz,Because I do.,
CADE004LI,CADE,Lili,Uh-huh.,
CAZE004TO,CAZE,System,Press /JournalButton/ to view JOURNAL and MAP.,
CADE006RA,CADE,Raz,Want to measure my wrist? Just in case.,
CADE007LI,CADE,Lili,"Mm, no.",
CADF000RA,CADF,Raz,"Hey, if you were going to make a friendship bracelet, you could maybe use this button here.",
CADF001LI,CADF,Lili,Why? So you could unbutton it and take it off when you got tired of being friends with me? ,
CADF002RA,CADF,Raz,Who said you were making it for me?,
CADF003LI,CADF,Lili,Uhhh--,
CADF004LI,CADF,Lili,"You know, if you were going to shut up, you could use that button on your lip. How about that?",
CADF005RA,CADF,Raz,Jeez.,
CADG000CM,CADG,Clem,Ah ha ha!,
CADG001CF,CADG,Crystal,Ow ha ah!,
CADG002CM,CADG,Clem,Look who's still punching!,
CADG003RA,CADG,Raz,Oh god. What have I done?,
CADH000RA,CADH,Raz,Hey! I'll bet you can't write a cheer about this red button.,
CADH001CM,CADH,Clem,Wanna bet? ,
CADH002CF,CADH,Crystal,You're on!,
CADH003CM,CADH,Clem,Red button is the best!,
CADH004CF,CADH,Crystal,It fastens up my vest!,
CADH005CM,CADH,Clem,"If it breaks like the rest,",
CADH006CF,CADH,Crystal,The boys will see my chest!,
CADI000JT,CADI,J.T.,"Hey, you're that new kid, ain't ya?",
CADI001RA,CADI,Raz,"Well, I'm doing some advanced training right now as a matter of fact, so I don't think ""New Kid"" is really a name that you want to get too used to saying.",
CADI002CP,CADI,Chops,"Hold on there. You're not doing Sasha Nein's advanced training that he does in his secret, underground lab are you?",
CADI003CP,CADI,Chops,Hidden deep within the iron walls of the GPC where no one can hear you screaming?,
CADI004RA,CADI,Raz,"Why, yes I am.",
CADI005JT,CADI,J.T.,Sakes alive!,
CADI006CP,CADI,Chops,"Well, nice knowing you.",
CADJ000RA,CADJ,Raz,"Hey, I brought you a new guitar pick. Look.",
CADJ001JT,CADJ,J.T.,"Aw, quit foolin'. That's just a button you took from the GPC across the creek.",
CADJ002CP,CADJ,Chops,Probably radioactive.,
CADJ003JT,CADJ,J.T.,Dang! Git that outta here!,
CADL000RA,CADL,Raz,"Hey, look, Chloe. I found a tiny, red space ship.",
CADL001CH,CADL,Chloe,"Nice fake Trynaxian Cruiser, Raz. But if you'd done even the most basic research, you'd know that real Trynaxian Cruisers have SIX viewports on top, not four.",
CADL002RA,CADL,Raz,Well I guess you just haven't seen THIS YEAR'S Trynaxian Cruiser then.,
CADL003CH,CADL,Chloe,The Trynaxian galaxy exploded 400 years ago.,
CADL004RA,CADL,Raz,Oh my god. This must be really valuable then. ,
CADN000BZ,CADN,Bobby,HEY!,
CADN001BN,CADN,Benny,Ay!,
CADP000RA,CADP,Raz,"Hey, check out this weird button!",
CADP001BZ,CADP,Bobby,Gah! No! Don't put me back in there! Please! I'll be good!,
CADP002BN,CADP,Benny,"Hey, boss! Boss! What's wrong?",
CADP003BZ,CADP,Bobby,"Uh, nothing. It's just, that button reminds me of a bad place. That's all. ",
CADP004BN,CADP,Benny,You heard the man. Get that button outta here!,
CADQ000PH,CADQ,Phoebe,Why I oughtta...,
CADQ001QU,CADQ,Quentin,"Simmer down there, Phoebe. You promised Milla you wouldn't burn any more kids.",
CADQ002PH,CADQ,Phoebe,Grr. Okay.,
CADR000RA,CADR,Raz,"Hey, just pretend this is a lighter.",
CADR001RA,CADR,Raz,It's red. ,
CADR002RA,CADR,Raz,"Pretty inspiring, eh?",
CADT000RA,CADT,Raz,This mean anything to you?,
CADT001FO,CADT,Ford,Ah yes. ,
CADT002RA,CADT,Raz,So...?,
CADT003FO,CADT,Ford,So? Sew red buttons on your underwear!,
CADT004RA,CADT,Raz,What does that mean? How will that help me find Sasha's lab?,
CADT005FO,CADT,Ford,How the heck do I know? It's just one of those things us old people like to say!,
CADU000RA,CADU,Raz,What can I buy with this button?,
CADU001FO,CADU,Ford,"We only take arrowheads here, kid. ",
CADU002FO,CADU,Ford,100% pure Psitanium arrowheads. Squeezed from the ground like magical pimples popped out of Mother Earth's own back.,
CADU003RA,CADU,Raz,Ew.,
CADV000RA,CADV,Raz,"Okay, here's my Oarsman's Badge.",
CADV001FO,CADV,Ford,"I'm not THAT blind, you little rat. Now beat it until you get the real thing.",
CADW000RA,CADW,Raz,Looks like you got that little patch of dirt pretty well raked.,
CADW001FO,CADW,Ford,Shush! I'm lookin' for my contact lens!,
CADX000RA,CADX,Raz,"Hey, do you know where this button belongs?",
CADX001FO,CADX,Ford,I know where it DOESN'T belong. It doesn't belong HERE in these off-limit woods! Just like you. Now g--,
CADX002FO,CADX,Ford,Oh. Wait. That's from the GPC. It DOES belong down here in these off-limit woods. Hmmm.,
CADX003FO,CADX,Ford,But you don't! So git!,
CADY001VE,CADY,Vernon,"Well, I tracked Dogen into the forest, but his footprints just... disappeared.",
CADY002RA,CADY,Raz,Really?,
CADY003VE,CADY,Vernon,"Yeah, and I tried to tag Elka, but she punched me.",
CADY004VE,CADY,Vernon,"I saw Milka run into this cave, so all I have to do now is wait.",
CADY005RA,CADY,Raz,Why don't you just run in there?,
CADY006VE,CADY,Vernon,"Never follow a snake into its hole, Raz. That is the code of the mongoose. The code of the hunter.",
CADY007RA,CADY,Raz,How's it going Mongoose?,
CADY008VE,CADY,Vernon,Everything is falling into place. We're moving into the endgame.,
CADZ000RA,CADZ,Raz,Dogen!,
CADZ001RA,CADZ,Raz,"Yeah, good idea. You rest here while I find your brains!",
CAEA000RA,CAEA,Raz,"Hey, I didn't know you guys were friends.",
CAEA001MH,CAEA,Mikhail,Small Maloof and I have arrangement.,
CAEA002MH,CAEA,Mikhail,"Instead of beating up bears, I get to beat up anyone who picks on Maloof.",
CAEA003RA,CAEA,Raz,What?,
CAEA004MH,CAEA,Mikhail,"Unbelievable, no? And he's not even charging me.",
CAEA005MF,CAEA,Maloof,"A lot of things are going to change around here, Razputin.",
CAEA006MF,CAEA,Maloof,A power shift. Some big figures will be going down. Some new stars rising. ,
CAEA007MF,CAEA,Maloof,"For the meek, justice. For the abusers of power, wedgies and Indian burns.",
CAEA008MF,CAEA,Maloof,Choose your sides wisely.,
CAEB000RA,CAEB,Raz,Gah!,
CAEB001MH,CAEB,Mikhail,No one touch Maloof any more!,
CAEB002MF,CAEB,Maloof,Mmm.,
CAEB003MF,CAEB,Maloof,"Let him go, Mikhail. He did me a favor once.",
CAEB004MF,CAEB,Maloof,"For that, he gets a one-day free ride.",
CAEB005MH,CAEB,Mikhail,You're lucky the boss is generous today.,
CAEB006RA,CAEB,Raz,Oof. Thanks.,
CAEC000RA,CAEC,Raz,(Gasp.),
CAEC001RA,CAEC,Raz,There she is!,
CAEC002MI,CAEC,Milla,"And there you are, darling!",
CAEC003MI,CAEC,Milla,"Don't worry, I got in contact with your father, and he's going to be here tomorrow to pick you up!",
CAEC004RA,CAEC,Raz,My... father?,
CAEC005MI,CAEC,Milla,"Ooh, got to go! The race is starting!",
CAED000JT,CAED,J.T.,Care to give it a try?,
CAED001RA,CAED,Raz,Okay...,
CAEE000BZ,CAEE,Bobby,What the?,
CAEE001RA,CAEE,Raz,Don't make me go get my fish friend again.,
CAEE002BZ,CAEE,Bobby,"Pfff! I ain't afraid of no Lungfish. Come on and get me, stupid Lungfish.",
CAEE003BZ,CAEE,Bobby,Oooh! Look at me! I can breathe!,
CAEE004BZ,CAEE,Bobby,Big deal! So can I!,
CAEG000MI,CAEG,Milla,"Don't be a stranger, darling.",
CAEG001RA,CAEG,Raz,"Thank you, Agent Vodello. ",
CAEG002RA,CAEG,Raz,Now it's back to the lab to save Dogen.,
CAEG003MI,CAEG,Milla,"Dogen's not in the lab, sweetie. He's watching TV in the lodge with the other children.",
CAEG004RA,CAEG,Raz,"I meant the dream Dogen from my Brain Tumbler vision. If I can find out what's happening to him, maybe that would give me a clue about who stole real Dogen's brain.",
CAEG005MI,CAEG,Milla,"Oh, I'm afraid he's just like that.",
CAEH000RA,CAEH,Raz,"Excuse me, Agent Vodello?",
CAEH001MI,CAEH,Milla,"Hello, darling. Are you back for another dance?",
CAEI000RA,CAEI,Raz,That's weird. Those guys just left all their stuff out here. Wonder what happened to them. ,
CAEL000RA,CAEL,Raz,What are you guys doing up here?,
CAEL001CF,CAEL,Crystal,"Oh, heyyyyyy Raz!",
CAEL002CM,CAEL,Clem,Didn't see you there!,
CAEL003CF,CAEL,Crystal,We're just looking at the sunset!,
CAEL004CM,CAEL,Clem,(Shh! Just wait until he leaves.),
CAEL005RA,CAEL,Raz,"It is a nice sunset, isn't it?",
CAEM000RA,CAEM,Raz,"Hey, Bobby. Wasn't that great when I beat you in that Levitation race?",
CAEM001RA,CAEM,Raz,"Hey, Bobby. Someone's stealing kids' brains!",
CAEM002BZ,CAEM,Bobby,"Well in that case, you've got nothing to worry about.",
CAEM003BZ,CAEM,Bobby,Ah-ha-ha-ha!,
CAEM004RA,CAEM,Raz,Good one.,
CAEM005BZ,CAEM,Bobby,BECAUSE YOU GOT NO BRAINS!,
CAEM006RA,CAEM,Raz,Yeah.,
CAEM007RA,CAEM,Raz,"Hey, Bobby--",
CAEM008BZ,CAEM,Bobby,Ah ha ha ha! No brains! Ha ha ha!,
CAEM009RA,CAEM,Raz,(Sigh.),
CAEN000RA,CAEN,Raz,"Whoa, uh, Elton. I hope you're not waiting for me.",
CAEN001RA,CAEN,Raz,"Oh, jeez. Sorry. Carry on, Sailor.",
CAEO000RA,CAEO,Raz,Admiral Cruller... ,
CAEO001RA,CAEO,Raz,That canoe... are you...,
CAEO002RA,CAEO,Raz,...in love with it?,
CAEO003FO,CAEO,Ford,What? No! I'm just checking it for psychic residue!,
CAEO004FO,CAEO,Ford,"Some kind of fish has been tearing holes in our canoes, and I'm trying to pick up its scent.",
CAEO005FO,CAEO,Ford,"(Ahh, don't worry now, baby. Nobody's ever going to hurt you again, I promise.)",
CAEP000VE,CAEP,Vernon,Wow. What an amazing story. ,
CAEP001VE,CAEP,Vernon,"I mean, that is a really, REALLY good story. And you know what the best part is?  ",
CAEP002VE,CAEP,Vernon,I'm in it!,
CAEP003VE,CAEP,Vernon,I'd better go write that whole thing down before we all get killed!,
CAEQ000VE,CAEQ,Vernon,"Hey, when Franke gets re-brained, tell her I'm okay, and our date's still on, okay?",
CAEQ001VE,CAEQ,Vernon,I don't want her to worry.,
CAER000NI,CAER,Nils,"That is some crazy stuff, guys. I'm kind of glad I was out for most of it.",
CAER001NI,CAER,Nils,"Well, with the world ending and everything, I should probably go see what girls want to make out one last time.",
CAES000RA,CAES,Raz,"Wow, I never thought YOU two would get back together.",
CAES001EL,CAES,Elka,I know! Isn't it just too romantic?,
CAES002EL,CAES,Elka,I just hope James won't be too crushed.,
CAES003NI,CAES,Nils,Shh. You promised--no talking.,
CAES004NI,CAES,Nils,Kinda busy.,
CAET000EL,CAET,Elka,Oh my god!,
CAET001RA,CAET,Raz,I know!,
CAET002EL,CAET,Elka,"I mean, OH  MY GOD!",
CAET004EL,CAET,Elka,NILS!!!,
CAEU000RA,CAEU,Raz,"Um, he's still in the... uh... oh never mind.",
CAEV000DO,CAEV,Dogen,...and so I'm really sorry for not believing you.,
CAEV001DO,CAEV,Dogen,"...right, yeah--that too. I should really not have blown so many of you up. I just get so confused sometimes.",
CAEW000MP,CAEW,Milka,Is Elton okay?,
CAEW001RA,CAEW,Raz,"Yeah, he's waiting for you down by the docks.",
CAEW002MP,CAEW,Milka,Gotcha.,
CAEW003RA,CAEW,Raz,"Hey, do you want to help us save the--",
CAEW004RA,CAEW,Raz,Typical.,
CAEX000RA,CAEX,Raz,"Well, he'll be fully brained soon, I promise.",
CAEX001MP,CAEX,Milka,"When he comes out, tell him I'm waiting for him down by the docks, okay?",
CAEY000EF,CAEY,Elton,Is Milka okay?,
CAEY001RA,CAEY,Raz,"Yeah, she's waiting for you down by the docks.",
CAEY003RA,CAEY,Raz,Is making out all anyone thinks about in this place?,
CAEZ000RA,CAEZ,Raz,"Well, she'll be fully brained soon, I promise.",
CAEZ001EF,CAEZ,Elton,"Well, when she comes out, tell her I'm waiting for her down by the docks, okay?",
CAFA000KI,CAFA,Kitty,"Well, there's only one thing that can make this better:",
CAFA001KI,CAFA,Kitty,Pedicure. See ya.,
CAFB000FA,CAFB,Franke,"Well, I can tell you one thing.",
CAFB001FA,CAFB,Franke,My dad is NEVER going to send me to this camp again.,
CAFB002FA,CAFB,Franke,Where's Kitty? Never mind. I'll find her.,
CAFC000MH,CAFC,Mikhail,"Well, if Brain Tank come after Mikhail, it will be sorry.",
CAFC001MH,CAFC,Mikhail,"Better go find tiny boss, see what is plan.",
CAFD000MH,CAFD,Mikhail,"Tell me, is tiny boss alive?",
CAFD001RA,CAFD,Raz,"Yes, and he'll be getting his brain back really soon.",
CAFD002MH,CAFD,Mikhail,"Ah, good. I take advantage of time off to find bear. ",
CAFE000MF,CAFE,Maloof,Now wire the other end to the gas tank.,
CAFE001MF,CAFE,Maloof,"Oh, hello Razputin.",
CAFE002RA,CAFE,Raz,What are you guys doing?,
CAFE003MF,CAFE,Maloof,"Taking care of business. The fewer questions you ask, the better.",
CAFF000MF,CAFF,Maloof,Sounds like it's time something bad happened to our fine Coach.,
CAFF001RA,CAFF,Raz,"Well, let me tell you what our plan is--",
CAFF002MF,CAFF,Maloof,Please. You have your plan. I have mine.,
CAFF003RA,CAFF,Raz,But--,
CAFF004MF,CAFF,Maloof,Say no more.,
CAFG002RA,CAFG,Raz,Do away with yourselves?,
CAFH000CF,CAFH,Crystal,O-M-G.  I feel so stupid for throwing myself off the roof now!,
CAFH001RA,CAFH,Raz,What? Why'd you throw yourself off the roof?,
CAFH002CF,CAFH,Crystal,Because the poison didn't work!,
CAFH003CF,CAFH,Crystal,"Listen, I have to go. The world could use some major league cheering right about now!",
CAFI000JT,CAFI,J.T.,Well shut mah mouth. I'd better go patrol the livin' quarters. Guard the womenfolk 'n' all.,
CAFI001JT,CAFI,J.T.,"Say, is my hombre walking around yet?",
CAFI002RA,CAFI,Raz,"Not yet, but soon!",
CAFI003JT,CAFI,J.T.,I just hope he forgives me for actin' like such a dang fool.,
CAFJ000RA,CAFJ,Raz,Yep. He's free-range.,
CAFK000JT,CAFK,J.T.,"It's time to circle the wagons, partner. That's the best plan right now.",
CAFK001JT,CAFK,J.T.,I'm busy patrollin' the homestead.,
CAFK002JT,CAFK,J.T.,With my partner Chops ridin' shotgun!,
CAFL000JT,CAFL,J.T.,I just wish Chops was here to ride shotgun!,
CAFM000CP,CAFM,Chops,"You know, I'll bet if J.T. wasn't so distracted, this wouldn't have happened. ",
CAFM001CP,CAFM,Chops,He's probably with that prissy little show pony right now.,
CAFM002RA,CAFM,Raz,"No, actually I think her mind's on other things at the moment.",
CAFM003CP,CAFM,Chops,Hm. Well maybe I'll go see what's up. One of us at least should be guarding the sleeping quarters.,
CAFN000CH,CAFN,Chloe,"Okay, here's the plan. I'm going to get on the Coach's radio, and call for help.",
CAFN001RA,CAFN,Raz,"See, now, that's an excellent idea! Why can't everyone be so helpful?",
CAFN002CH,CAFN,Chloe,"Yeah, I modified the antenna so now it broadcasts straight into outer space!",
CAFN003RA,CAFN,Raz,Oh man.,
CAFO000RA,CAFO,Raz,"...yes, and because you got your brain stolen and I didn't, yes. I do. I think I'm better than you.",
CAFO001BZ,CAFO,Bobby,Ah ha! I knew it! ,
CAFO002BZ,CAFO,Bobby,"Well, you're wrong!",
CAFO003BZ,CAFO,Bobby,Have fun dying!,
CAFP000BN,CAFP,Benny,Hmm. So does the Coach... does he have an evil sidekick?,
CAFP001BN,CAFP,Benny,"A yes man, or a lickspittle?",
CAFP002BN,CAFP,Benny,Anything?,
CAFP003RA,CAFP,Raz,Not sure. Why?,
CAFP004BN,CAFP,Benny,"Uh, no reason. Bye!",
CAFQ000PH,CAFQ,Phoebe,"Oh, man. I just want to burn that Coach!",
CAFQ001PH,CAFQ,Phoebe,"Hey, where's Quentin?",
CAFR000RA,CAFR,Raz,We're going to be re-braining him really soon.,
CAFR001PH,CAFR,Phoebe,"I have to go hit something. Tell him I went to go hit stuff, okay?",
CAFS000RA,CAFS,Raz,He's waiting for you at band practice.,
CAFS001PH,CAFS,Phoebe,He better not be painting the wrong band name on my drums again!,
CAFT000QU,CAFT,Quentin,Wow. That is so not chill.,
CAFT001QU,CAFT,Quentin,"Hey, where's Phoebe?",
CAFT002RA,CAFT,Raz,We're gonna be re-braining her really soon.,
CAFT003QU,CAFT,Quentin,"Well, when she comes out, she's going to want to hit stuff. I'd better go wait by her drums.",
CAFU000RA,CAFU,Raz,She's waiting for you at band practice.,
CAFU001QU,CAFU,Quentin,"Awesome. Okay, check you out later, my bros.",
CAFV000FO,CAFV,Ford,"Listen, you gotta help. You gotta kill me, son. I can't take the cheering anymore. ",
CAFV001RA,CAFV,Raz,I'm sorry I put their brains back. Maybe a bear will get them soon.,
CAFV002FO,CAFV,Ford,"Maybe. If not, you gotta find my drain cleaner and pour it down my throat, okay?",
CAFW000RA,CAFW,Raz,"Mr. Cruller, there's a big mess that you gotta help me clean up!",
CAFW001FO,CAFW,Ford,Really? Where? I'll get the jet!,
CAFW002RA,CAFW,Raz,"People are missing, kids' brains have been stolen, Coach Oleander is trying to take over the world...",
CAFW003FO,CAFW,Ford,Aw psh! Not my kind of mess.,
CAFW004RA,CAFW,Raz,Won't you help?,
CAFW005FO,CAFW,Ford,I'm a janitor. Let me know when somebody drops a carton of eggs or something.,
CAFX000RA,CAFX,Raz,"Admiral, sir! Did you hear that? The Hideous Hulking Lungfish of Lake Oblongata just kidnapped Lili!",
CAFX001FO,CAFX,Ford,LUNGFISH?!,
CAFX002FO,CAFX,Ford,So THAT'S what's been tearing up my canoes!,
CAFX003FO,CAFX,Ford,"Well, I know just what to do!",
CAFX004RA,CAFX,Raz,You do? Great!,
CAFX005FO,CAFX,Ford,"Yeah, I've got some lungfish-proof shellac. I'll just slap on a fresh coat, maybe two, and that's that!",
CAFX006RA,CAFX,Raz,"Admiral, the monster is still out there, and Coach Oleander is trying to take over the world!",
CAFX007FO,CAFX,Ford,"Ah, yes, the world is a crazy place, son. But don't worry.",
CAFX008FO,CAFX,Ford,The canoes are safe.,
CAFY000RA,CAFY,Raz,"Mr. Cruller, you gotta help! Kids are getting kidnapped, and everyone's missing, and their brains are stolen, and I think the Coach is trying to take over the world with Psychically-armed death tanks!",
CAFY001FO,CAFY,Ford,"Well, now you see what happens when you go to parts of the forest that are off limits? ",
CAFY002FO,CAFY,Ford,I'm a Ranger. I've got enough problems wrangling these leaves! Now git!,
CAFZ000DO,CAFZ,Dogen,"Wow, I guess that's what those squirrels were trying to tell me.",
CAFZ001RA,CAFZ,Raz,Huh?,
CAFZ002DO,CAFZ,Dogen,"They kept saying, ""The tiny man is going to kill everyone.""",
CAFZ003DO,CAFZ,Dogen,I thought they were talking about me!,
CAFZ004DO,CAFZ,Dogen,Oh man. I have to go apologize.,
CADD005RA,CADD,Raz,Hmm. Looks like one of the buttons is missing.,
CADD006RA,CADD,Raz,"Call me crazy, but I have a weird feeling that the button Sasha gave me goes here.",
CADD007RA,CADD,Raz,Heh heh heh.,
CAZE005TO,CAZE,System,Move RIGHT /Joystick/ to look around.,
CAGA000FO,CAGA,Ford,"Okay, quick eye exam before we start.",
CAGA002FO,CAGA,Ford,Look over that way if you will. ,
CAGA004FO,CAGA,Ford,"No, that way.",
CAGA005FO,CAGA,Ford,Look over there.,
CAGA006FO,CAGA,Ford,Over there.,
CAGA007FO,CAGA,Ford,"Clocks a-tickin', Sonny!",
CAGA008RA,CAGA,Raz,"Wow, what's that?",
CAGA009FO,CAGA,Ford,That's a PSI CHALLENGE MARKER. The staff scatters these all over the camp to test the students. Every one of these you find advances you a whole rank.,
CAGA010RA,CAGA,Raz,Ah ha...,
CAGA011FO,CAGA,Ford,"Now, look up for me if you will.",
CAZE006TO,CAZE,System,Move right thumbstick [vertical joystick icon] to look up.,
CAGA013FO,CAGA,Ford,Up. Up there.,
CAGA014FO,CAGA,Ford,Come on.,
CAGA015FO,CAGA,Ford,You see where I'm pointing?,
CAGA016RA,CAGA,Raz,Hmmm,
CAGA017FO,CAGA,Ford,Some of the old markers have fallen apart. You'll find bits of 'em flapping around loose.,
CAGA018FO,CAGA,Ford,"If you find enough of these PSI CARDS, you can put 'em together to make a brand new Challenge Marker...",
CAGA019FO,CAGA,Ford,...But you have to buy a PSI CORE at the camp store to hold them together.,
CAGA020FO,CAGA,Ford,Keep ranking up and before you know it you'll be able to use brand new psychic powers. Stuff you didn't even know you could do. ,
CAGA021RA,CAGA,Raz,And then when do I become a Psychonaut? ,
CAGA022RA,CAGA,Raz,Because I have to do that before my dad shows up to take me home...,
CAGA023RA,CAGA,Raz,"Hey, where'd he go?",
CAGA024RA,CAGA,Raz,That guy looked so familiar...,
CAGB000VE,CAGB,Vernon,"Hey, why are you trying to firestart me, Raz?",
CAGB001NI,CAGB,Nils,Don't be a dork. Go burn something else.,
CAGB002EL,CAGB,Elka,If you don't stop trying to burn me right now I am going to SCREAM!,
CAGB004MP,CAGB,Milka,Quit it!,
CAGB005KI,CAGB,Kitty,Go burn someone who cares.,
CAGB006FA,CAGB,Franke,"Stop trying to burn me, creep!",
CAGB007MH,CAGB,Mikhail,"Thanks, but I am warm enough in my thick, Russian hat.",
CAGB008MF,CAGB,Maloof,"This burning choice you've made is a poor one, Razputin.",
CAGB009LI,CAGB,Lili,Is this how you tell girls you have a crush on them? It's annoying.,
CAGB010CM,CAGB,Clem,"Right on, Raz! You learned firestarting! Good for you!",
CAGB011CF,CAGB,Crystal,Hee hee hee! Yay! Firestarting practice! Woo!,
CAGB012JT,CAGB,J.T.,"Move along, little doggy. Nothin' to burn here.",
CAGB013CP,CAGB,Chops,"Careful, eh? My hair goes up in flames and we're all goners.",
CAGB014CH,CAGB,Chloe,Hm. Atmospheric changes in effect. Adjusting helmet thermostat.,
CAGB015BZ,CAGB,Bobby,"Man, what is that smell?",
CAGB016BN,CAGB,Benny,My ears are burning. Kitty must be talking about me!,
CAGB017EF,CAGB,Elton,Oh man. I hope I don't get much hotter. That would be uncomfortable.,
CAGB018PH,CAGB,Phoebe,Oh no. Is my problem back? Have to calm down. Can't burn anything. Cannot burn anything!,
CAGB019QU,CAGB,Quentin,"Ooh, feels like Phoebe's having another flare up!",
