identifier,labels,context,source,translation
CAGB020SA,CAGB,Sasha,"I'm sure you could find a more productive use for that skill, Razputin.",
CAGB021MI,CAGB,Milla,"Please, this is polyester. I'm hot enough!",
CAGB022CO,CAGB,Coach,"Save it for the battlefield, soldier.",
CAGC000VE,CAGC,Vernon,"Hey, put me down!",
CAGC001NI,CAGC,Nils,Drop me or I will drop you!,
CAGC002EL,CAGC,Elka,"Hey! Grow up, Razputin!",
CAGC003DO,CAGC,Dogen,I'm not supposed to get wild at camp!,
CAGC004MP,CAGC,Milka,Grrrr!,
CAGC005KI,CAGC,Kitty,"Hey, put me down or my dad will sue your whole family!",
CAGC006FA,CAGC,Franke,Put me down or Kitty's dad will sue your whole family!,
CAGC007MH,CAGC,Mikhail,"Hm. Thanks for the boost. But no, still can see no bears from up here.",
CAGC008MF,CAGC,Maloof,"What are you trying to prove, Raz?",
CAGC009LI,CAGC,Lili,I'm going to be quiet and hope that you just go away.,
CAGC010CM,CAGC,Clem,Haha! Yay! Raz learned Telekinesis! Right on!,
CAGC011CF,CAGC,Crystal,"Wow, you're really good at Telekinesis, Raz! That's awesome!",
CAGC012JT,CAGC,J.T.,Put me down partner or I'll show you what a good shot I am!,
CAGC013CP,CAGC,Chops,"What's this all about, eh?",
CAGC014CH,CAGC,Chloe,Finally! I'm being TAKEN! They've finally come for me! Hey! It's just you. PUT ME DOWN!,
CAGC015BZ,CAGC,Bobby,"Oh, that was your fatal mistake. I hope you have a will.",
CAGC016BN,CAGC,Benny,Lemme down! Lemme down!,
CAGC017EF,CAGC,Elton,"Okay, I really don't like being up this high.",
CAGC018PH,CAGC,Phoebe,Hey! Rrrrr! Enough! Hello! Put me down!,
CAGC019QU,CAGC,Quentin,"Hey, free airplane rides today! ",
CAGC020SA,CAGC,Sasha,Impressive. Now release.,
CAGC021MI,CAGC,Milla,I was already floating Razputin. That's hardly a challenge.,
CAGC022FO,CAGC,Ford,"Okay, that's funny. Now PUT ME DOWN.",
CAGC023CO,CAGC,Coach,"What the--ha! That's some mind you got there, kid. If you want to keep it, I suggest you put me down.",
CAGD000VE,CAGD,Vernon,Oooh-ooooh...,
CAGD020SA,CAGD,Sasha,"I am not so easily confused, Razputin.",
CAGD021MI,CAGD,Milla,"There are other ways to meet girls, Razputin.",
CAGD023FO,CAGD,Ford,I told you them burgers ain't ready!,
CAGD024FO,CAGD,Ford,This part of the forest is off limits! Now git!,
CAGD025FO,CAGD,Ford,Stop starin' at my mops!,
CAGD026FO,CAGD,Ford,"You will call me ADMIRAL, Sonny!",
CAGD027CO,CAGD,Coach,"Oooh-ooooh... Mr. Bun, where you going? Ohhhh",
CAGE000RA,CAGE,Raz,Hey can I buy some stuff?,
CAGE001FO,CAGE,Ford,"Yeah, but hurry up. I don't want to burn my burgers. ",
GLZB013TO,GLZB,System,Dream Fluff,
CAGE003FO,CAGE,Ford,"Mmmm. Dream Fluffs! Delicious, nutritious and cheap!",
CAGE004FO,CAGE,Ford,Each one is packed with concentrated mental health!,
CAGE005FO,CAGE,Ford,You shouldn't go anywhere without a pocket full of those!,
GLZB014TO,GLZB,System,PSI Core,
CAGE007FO,CAGE,Ford,Now you take that PSI CORE there...,
CAGE008FO,CAGE,Ford,"Put it together with nine PSI CARDS, and you'll have yourself a brand new PSI Challenge Marker!",
CAGE009FO,CAGE,Ford,"Which is worth a whole rank, you know.",
GLZB015TO,GLZB,System,Cobweb Duster,
GLZH019TO,GLZH,System,Rank requirement: 15,
CAGE012FO,CAGE,Ford,Oh that's my last Cobweb Duster.,
CAGE013FO,CAGE,Ford,"Take that into someone's mind with ya, you can clean up!",
CAGE014FO,CAGE,Ford,"They're happy to be rid of the webs, and you can turn them in for PSI Cards!",
GLZB016TO,GLZB,System,Dowsing Rod,
GLZH020TO,GLZH,System,Rank Requirement: 10,
CAGE017FO,CAGE,Ford,Now that Dowsing Rod will help you find arrowheads that are buried DEEP.,
CAGE018FO,CAGE,Ford,"That's where all the really valuable ones are, you know. ",
CAGE019FO,CAGE,Ford,Find three or four deep deposits and that baby pays for itself.,
CAGE020FO,CAGE,Ford,It costs you money because it MAKES you money!,
GLZB017TO,GLZB,System,PSI Energy Colorizer,
GLZH021TO,GLZH,System,Rank Requirement: 40,
CAGE023FO,CAGE,Ford,"Now with that, you can change the color of some of your PSI powers, like your Levitation Ball, and what have you and whatnot.",
CAGE024FO,CAGE,Ford,"Well. kind of a vanity thing. In my day PSI powers were all gray and we thought that was grand. We were happy just to HAVE PSI powers. Ah, but you know kids these days.",
CAZB004TO,CAZB,System,Posters,
CAGE026FO,CAGE,Ford,"Eh, got some posters here.",
CAGE027FO,CAGE,Ford,You can hang 'em in your cabin.,
CAGE028FO,CAGE,Ford,Makes it just like home!,
CAGE029RA,CAGE,Raz,"Hey, can you put that on my tab?",
CAGE030FO,CAGE,Ford,"Ah, sorry, mac. No can do. We only trade in hard, cold, Psitanium Arrowheads here.",
CAGE031FO,CAGE,Ford,"If you don't have enough, why don't you run around outside a bit and dig some up?",
CAGE032FO,CAGE,Ford,Or crack open some mental vaults. Always something valuable in a vault!,
CAGE033RA,CAGE,Raz,I don't have enough arrowheads for that!,
CAGE034FO,CAGE,Ford,"Well then, quit lookin' at it!",
CAGE035FO,CAGE,Ford,"Ah, it doesn't look like you've got the rank you need there, kiddo.",
CAGE036FO,CAGE,Ford,And there's no excuse for that! Plenty of ways to get promoted around here!,
CAGE037FO,CAGE,Ford,"Collecting mental figments and cobwebs helps you rank up. So does finding PSI challenge markers, or building them out of PSI cards and cores.",
CAGE038FO,CAGE,Ford,"You also rank up when you sort people's emotional baggage, and if you want to skip a bunch of ranks at once, well you should talk to the camp Ranger about his Scavenger Hunt contest.",
CAGE039RA,CAGE,Raz,I don't have a high enough rank to buy that yet!,
CAGE040FO,CAGE,Ford,Not yet. But maybe in a few years.,
CAGE041RA,CAGE,Raz,I'll take it!,
CAGE042FO,CAGE,Ford,Alrighty then. ,
CAGE043FO,CAGE,Ford,Excellent choice!,
CAGE044FO,CAGE,Ford,Sold! To the big-headed kid with the gloves!,
CAGE045FO,CAGE,Ford,What else can I do you for?,
CAGE046RA,CAGE,Raz,That's it for now.,
CAGE047FO,CAGE,Ford,Alright. Go get more arrowheads and come on back.,
CAGE048FO,CAGE,Ford,Support your local merchants!,
CAGF000RA,CAGF,Raz,Oof! Hey...,
CAGF001BY,CAGF,Minecart-System,Welcome to the Whispering Rocket Underground Rapid Transit System.,
CAGF002BY,CAGF,Minecart-System,"Would you like to go back to your private sanctuary now, Agent Cruller? Or... somewhere else?",
CAGF003BY,CAGF,Minecart-System,"Where would you like me to take you, Agent Cruller?",
CAGF004RA,CAGF,Raz,Take me to the Kids' Cabins area.,
CAGF005BY,CAGF,Minecart-System,With pleasure.,
CAGF006RA,CAGF,Raz,Drop me outside the main lodge.,
CAGF007BY,CAGF,Minecart-System,"Oh, bring me back a burger this time, will you?",
CAGF008RA,CAGF,Raz,I'm headed for the parking lot.,
CAGF009BY,CAGF,Minecart-System,"I hope you're not leaving us, sir.",
CAGF010RA,CAGF,Raz,I want to go to the campfire area.,
CAGF011BY,CAGF,Minecart-System,Mmm. You look so cute in that janitor outfit!,
CAGF012RA,CAGF,Raz,"Let's go to Ford's--I mean, MY sanctuary.",
CAGF013BY,CAGF,Minecart-System,"Yes, noble Psychomaster.",
CAGF014RA,CAGF,Raz,It's time to go to the lake!,
CAGF015BY,CAGF,Minecart-System,"Yessir, Admiral Sir!",
CAGF016RA,CAGF,Raz,Bring me near the Geodesic Psychoisolation Chamber.,
CAGF017BY,CAGF,Minecart-System,"Roger that, Ranger Cruller!",
CAGF018RA,CAGF,Raz,Nowhere! I just like to come down here to hear your voice.,
CAGF019BY,CAGF,Minecart-System,"Pop in anytime, sir.",
CAGG000SA,CAGG,Sasha,Is that the cleaning lady? ,
CAGG001SA,CAGG,Sasha,"I'll get those files out of your way, just as soon as I'm done with these... tests...",
CAGG002SA,CAGG,Sasha,"Ah, yes. Thank you Razputin, for helping me clean up.",
CAGH000RA,CAGH,Raz,Is this going to hurt?,
CAGH001RA,CAGH,Raz,Have you tested this thing out on humans yet?,
CAGH002RA,CAGH,Raz,Will I get in trouble with Milla? She told me not to take any paranormal training while I'm here.,
CAGH003RA,CAGH,Raz,Could you try it first?,
CAGH004RA,CAGH,Raz,"Okay, I'm ready to learn how to really fight!",
CAGH005SA,CAGH,Sasha,Oh. Really? Hm.,
CAGH006RA,CAGH,Raz,What?,
CAGH007SA,CAGH,Sasha,"Uh, nothing. It's just that I didn't think you'd really take me up on that offer. It usually scares the kids off.",
CAGH008RA,CAGH,Raz,"Well, not me. I'm ready to kill for my camp!",
CAGH009SA,CAGH,Sasha,"Listen, I'm sorry, but I can't train you. Agent Vodello would kill me.",
CAGH010RA,CAGH,Raz,What's the big deal? What she doesn't know won't hurt her.,
CAGH011SA,CAGH,Sasha,You don't even have a Marksmanship Learner's Permit. I could lose my job!,
CAGH012RA,CAGH,Raz,I'll get one!,
CAGH013SA,CAGH,Sasha,Even if you used that secret passage over there and snuck into his sanctuary...,
CAGH014SA,CAGH,Sasha,Agent Cruller would never give you a Marksmanship Learner's permit.,
CAGH015RA,CAGH,Raz,Agent Cruller...,
CAGH016SA,CAGH,Sasha,Never in a million--,
CAGH017RA,CAGH,Raz,I'm off! Be right back after I talk with Agent Cruller!,
CAGH018SA,CAGH,Sasha,Did you convince Agent Cruller to give you a Marksmanship Learner's Permit yet?,
CAGH019RA,CAGH,Raz,Oh... uh... yes. But I left it in my other pants. Be right back.,
CAGH020RA,CAGH,Raz,Okay I got it. Check it out.,
CAGH021SA,CAGH,Sasha,Well my ass is covered.,
CAGH022SA,CAGH,Sasha,Are you sure you are ready to do this? It could be dangerous.,
CAGH023RA,CAGH,Raz,Yes! Are you going to pull me into your mind like the Coach did?,
CAGH024SA,CAGH,Sasha,"Ha. No offense, but it's time you saw what an organized mind looks like.",
CAGH025RA,CAGH,Raz,Almost! I just have to get my affairs in order first.,
CAGH026RA,CAGH,Raz,Just in case I die.,
CAGH027SA,CAGH,Sasha,Come back when you are ready.,
CAGH028RA,CAGH,Raz,"Okay, time to face my big, diving-helmet spitting personal demons.",
CAGH029SA,CAGH,Sasha,That's the spirit.,
CAGH030RA,CAGH,Raz,"Okay, I'm a certified levitator now. Ready to roll. ",
CAGH031SA,CAGH,Sasha,Hmm.,
CAGH032SA,CAGH,Sasha,I've been running some tests. It seems that the sensitive circuitry of the Brain Tumbler is picking up too much psychic interference to be safe. ,
CAGH033SA,CAGH,Sasha,"The thoughts of some other entity are interlacing with yours at a dangerous level, which explains many of the strange things you've seen.",
CAGH034SA,CAGH,Sasha,I must call off the experiments until we know more.,
CAGH035RA,CAGH,Raz,"Sasha, there's no time. I think my vision about Dogen came true. I'm worried it's going to happen to the others if we don't get to the bottom of this quick.",
CAGH036SA,CAGH,Sasha,But we don't know where the foreign projections are coming from yet.,
CAGH037RA,CAGH,Raz,Is there a faster way to find out than sending me in there to investigate?,
CAGI000RA,CAGI,Raz,Wow. Is this what the inside of my mind looks like?,
CAGI001SA,CAGI,Sasha,Not yet. You are still traveling through the astral plane.,
CAGI002SA,CAGI,Sasha,This is a tiny corner of what we call the Collective Unconscious--a place in which all of our unconscious minds are connected.,
CAGI003SA,CAGI,Sasha,"You have just begun your training, Razputin, so many of the connections with other minds are still not developed for you, and those doorways remain just out of reach.",
CAGI004SA,CAGI,Sasha,"But the more you explore the mental world, the more connections you will form.",
CAGI005SA,CAGI,Sasha,Right now the only unconscious world you can enter is that one.,
CAGI006SA,CAGI,Sasha,Your own.,
CAGI007SA,CAGI,Sasha,Step through it and we'll continue.,
CAGJ000CO,CAGJ,Coach,Oof!,
CAGJ001RA,CAGJ,Raz,Hi. I'm here for Basic Braining?,
CAGK000RA,CAGK,Raz,They seem to all be in a trance while they astrally project themselves into the Coach's psyche.,
CAGK001RA,CAGK,Raz,Which is awesome.,
CAGL000DO,CAGL,Dogen,Shut up!,
CAGL001DO,CAGL,Dogen,I am not!,
CAGL002DO,CAGL,Dogen,I wouldn't!,
CAGL003DO,CAGL,Dogen,I'm not going to do that!,
CAGL004DO,CAGL,Dogen,You squirrels think you're so smart!,
CAGL005DO,CAGL,Dogen,Ooooh! I'm so cool. I'm a squirrel.,
CAGL006DO,CAGL,Dogen,Well you know what we call you? Rats with wings.,
CAGL007DO,CAGL,Dogen,"Well, then we call you something else. Nut rats!",
CAGL008DO,CAGL,Dogen,Fluffy rats!,
CAGL009DO,CAGL,Dogen,And what's that supposed to mean?,
CAGL010DO,CAGL,Dogen,"It's a special hat, and you should be glad I'm wearing it!",
CAGL011DO,CAGL,Dogen,No!,
CAGL012DO,CAGL,Dogen,Never!,
CAGL013DO,CAGL,Dogen,"I do too understand what you're saying, and I don't appreciate it!",
CAGL014DO,CAGL,Dogen,You guys are making me so mad!,
CAGL015DO,CAGL,Dogen,Quit it! You'll knock off my special hat!,
CAGM000RA,CAGM,Raz,"Hey, sorry about hitting you a minute ago. That was totally an accident.",
CAGM001DO,CAGM,Dogen,"Oh, okay, Raz. I know you wouldn't do that on purpose.",
CAGM002RA,CAGM,Raz,"What are they lying to you about, anyway?",
CAGM003DO,CAGM,Dogen,Nothing!,
CAGM004RA,CAGM,Raz,"Hey, what happened to the squirrels?",
CAGM005DO,CAGM,Dogen,They lied. They lied... and then--then--then they--they left.,
CAGN000PH,CAGN,Phoebe,You're lucky I'm not burning people any more.,
CAGN001QU,CAGN,Quentin,"Not cool, bro.",
CAGO000LI,CAGO,Lili,Grow up.,
CAGP000CH,CAGP,Chloe,"Earthling violence is why we haven't been asked to join the greater galactic community, you know. ",
CAGQ000NI,CAGQ,Nils,Hmmm.,
CAGQ002NI,CAGQ,Nils,Grrrr.,
CAGQ003NI,CAGQ,Nils,(Sigh.),
CAGQ005NI,CAGQ,Nils,"Quit it, Bobby! I know that's you! Jerk.",
CAGR000MH,CAGR,Mikhail,"Ah, thanks for offer, but only want to fight bear today.",
CAGR001MH,CAGR,Mikhail,Mikhail will find you.,
CAGS000FO,CAGS,Ford,"That's not how true Psychonauts behave, Razputin.",
CAGT000CO,CAGT,Coach,Can't you see I'm busy here?,
CAGT001CO,CAGT,Coach,(Grunt.),
CAGU000VE,CAGU,Vernon,"Raz, I'm sorry but that's not how you play this game.",
CAGV000NI,CAGV,Nils,"Now I'm NEVER going to show you how to do this, jerk!",
CAGW000EL,CAGW,Elka,(...mutter...),
CAGW003EL,CAGW,Elka,Nils?,
CAGW004EL,CAGW,Elka,Nils!,
CAGW005EL,CAGW,Elka,Nils...,
CAGW007DO,CAGW,Dogen,Uh,
CAGW008DO,CAGW,Dogen,Ummmmm,
CAGW009DO,CAGW,Dogen,I dunno.,
CAGW010EL,CAGW,Elka,"Just ignore him, Dogen. He's trying to nose his way into our private conversation.",
CAGW011DO,CAGW,Dogen,But...,
CAGX000MP,CAGX,Milka,Eep.,
CAGX001MP,CAGX,Milka,Eek.,
CAGX002MP,CAGX,Milka,Grk.,
CAGY000KI,CAGY,Kitty,"Just ignore him, Franke.",
CAHA003MF,CAHA,Maloof,Hey!,
CAHA004MF,CAHA,Maloof,Is anybody out there?,
CAHA005MF,CAHA,Maloof,Let me out!,
CAHA006MF,CAHA,Maloof,Hellllllp!,
CAHA007MF,CAHA,Maloof,Somebody!,
CAHA008MF,CAHA,Maloof,There's no bathroom in here!,
CAHB000LI,CAHB,Lili,"Hey, quit it!",
CAHB001LI,CAHB,Lili,Ow. You're lucky you're no good at that yet.,
CAHC000JT,CAHC,J.T.,Hey! You make me chip a tooth on this mouth harp and there's gonna be a showdown!,
CAHC001CP,CAHC,Chops,Careful eh? I just got this thing in tune!,
CAHE000BZ,CAHE,Bobby,Ha ha ha!,
CAHE005BZ,CAHE,Bobby,Look at him squirm!,
CAHE006BZ,CAHE,Bobby,That's the funniest thing I ever saw!,
CAHE007BZ,CAHE,Bobby,I think I'm going to puke that's so funny.,
CAHE008BZ,CAHE,Bobby,Stupid fish!,
CAHE009BZ,CAHE,Bobby,Think you're better than us cuz you can swim?,
CAHE015BN,CAHE,Benny,So funny!,
CAHE016BN,CAHE,Benny,"Good one, Bobby!",
CAHE017BN,CAHE,Benny,"You've got the best ideas, Bobby!",
CAHE018BN,CAHE,Benny,"Yeah, stupid fish!",
CAHE019BN,CAHE,Benny,"Man, do I hate fish!",
CAHE020BZ,CAHE,Bobby,"Oh, no you don't!",
CAHE021BZ,CAHE,Bobby,Oopsy daisy!,
CAHF000RA,CAHF,Raz,Elton. Ask if any of them have lost a big red button.,
CAHG000FO,CAHG,Ford,"Ah, eager to get whacked on the head with a broom handle too, I see!",
CAHG001FO,CAHG,Ford,Hey! I should wring you out like a wet mop!,
CAHG002FO,CAHG,Ford,"How about I clean your clock instead of the floor, eh?",
CAHH000FO,CAHH,Ford,"I will flip you like a half-done burger, boy.",
CAHH001FO,CAHH,Ford,"I will take out your intestines, fry 'em into hash browns, and sew 'em back into your body before you ever get the chance to try that again!",
CAHH002FO,CAHH,Ford,"How'd you like to be branded with a hot spatula, eh?",
CAHI000FO,CAHI,Ford,I will take one of these paddles to your psychic behind if you don't knock that off!,
CAHI001FO,CAHI,Ford,"I will sink you so deep in that lake, no dredge crew would ever find ya.",
CAHI002FO,CAHI,Ford,"I'll make a canoe out of your hide, if you try that one more time!",
CAHJ000FO,CAHJ,Ford,Ow!,
CAHJ001FO,CAHJ,Ford,Aye!,
CAHJ003FO,CAHJ,Ford,I will rake you into the next dimension if you don't knock that off.,
CAHJ004FO,CAHJ,Ford,"I will whittle you into a neckerchief holder in two seconds, you hear me?",
CAHJ005FO,CAHJ,Ford,"I know places in these woods, I could hide a body so nobody would find it, ever.",
CAHJ006FO,CAHJ,Ford,I will burn you like a pile of autumn leaves if you do that again.,
CAHK000VE,CAHK,Vernon,Shhh! You'll tip off my target.,
CAHK001VE,CAHK,Vernon,Don't tell anyone I'm out here!,
CAHK002RA,CAHK,Raz,Roger.,
CAHK003VE,CAHK,Vernon,You see those guys?,
CAHK004RA,CAHK,Raz,Nope.,
CAHK005VE,CAHK,Vernon,Hm.,
CAHL000RA,CAHL,Raz,Hey are you guys getting back together?,
CAHL003EL,CAHL,Elka,"Hey, only I get to hit him!",
CAHL004NI,CAHL,Nils,"Hey, if I can't hit her, neither can you!",
CAHM000RA,CAHM,Raz,"Hey, what's on?",
CAHM001RA,CAHM,Raz,"What do you like better, TV or air?",
CAHM002RA,CAHM,Raz,"Hey, do you happen to know the country code for Tuvalu?",
CAHM003RA,CAHM,Raz,First question: What do you think the queen is drinking right now? Second question: What was your favorite science fiction miniseries in the eighties?,
CAHM004DO,CAHM,Dogen,TEE VEE!,
CAHN000RA,CAHN,Raz,"Oh, man. These guys are all getting Advanced Levitation training while I'm just standing here!",
CAHN001RA,CAHN,Raz,Yeah. I remember back when I was still in Levitation class.,
CAHP000RA,CAHP,Raz,Heck yeah! Let me at them doggies!,
CAHP001JT,CAHP,J.T.,"Okay then, let's see some fancy shootin!",
CAHP002RA,CAHP,Raz,"Nah, I don't feel like shooting right now. I've got a headache.",
CAHP003JT,CAHP,J.T.,"Ah, me too. ",
CAHP004JT,CAHP,J.T.,Is yours named Elka Doom too?,
CAHP005JT,CAHP,J.T.,Ah ha ha.,
CAHP006JT,CAHP,J.T.,"Wait. She's not around these parts, is she?",
CAHQ000JT,CAHQ,J.T.,"Hey, not bad city slicker!",
CAHQ001JT,CAHQ,J.T.,Bull's-eye!,
CAHQ002JT,CAHQ,J.T.,Hooooo dawg!,
CAHQ003JT,CAHQ,J.T.,Nice job!,
CAHQ004JT,CAHQ,J.T.,Good shootin!,
CAHQ005JT,CAHQ,J.T.,"Aw, next time.",
CAHQ006JT,CAHQ,J.T.,That was close!,
CAHQ007JT,CAHQ,J.T.,"Oooh, too bad.",
CAHQ008JT,CAHQ,J.T.,Steady...,
CAHQ009JT,CAHQ,J.T.,"If that was a rustler, he'd a gotten away!",
CAHS000RA,CAHS,Raz,"I, uh, haven't told Bobby to lay off the fish torture yet, but I'm going to.",
CAHS001EF,CAHS,Elton,Uh-huh.,
CAHS002RA,CAHS,Raz,"Okay, if you guys need me I'm going to be studying Levitation with Milla Vodello.",
CAHS003RA,CAHS,Raz,The Mental Minx?,
CAHT000RA,CAHT,Raz,"Yes, I'd like to practice some more on the Levitation course.",
CAHT001MI,CAHT,Milla,Well... class is over. But the party never ends!,
CAHT002RA,CAHT,Raz,"No, I'm here to warn you.  I think there is a monster in the lake!",
CAHT003MI,CAHT,Milla,You mean the Hideous Hulking Lungfish of Lake Oblongata?,
CAHT004MI,CAHT,Milla,"Darling, every summer camp has its stories. But that's all they are.",
CAHT005RA,CAHT,Raz,This one ate Dogen's brains.,
CAHT006MI,CAHT,Milla,"Now, stop spreading rumors. I know Dogen seems a little... naive... but he is actually a very powerful psychic.",
CAHT007MI,CAHT,Milla,"You know what it's like to stand out, Razputin, so maybe you could help him out, eh?",
CAHT008RA,CAHT,Raz,"Well, I just wanted to stop by and say hi.",
CAHT009MI,CAHT,Milla,"Oh, how nice. Isn't it a lovely day? It just seems like on a beautiful day like this, nothing could go wrong, you know?",
CAHU000VE,CAHU,Vernon,"Oh, now Raz, you made me lose my place. Where was I, girls?",
CAHU001VE,CAHU,Vernon,Oh well. Guess I have to start over at the beginning!,
CAHU002VE,CAHU,Vernon,(Ahem ahem.),
CAHU003RA,CAHU,Raz,"Vernon, you keep watch over these guys while I try to find their brains. I'm going back to Sasha's Lab now to find out what's going on.",
CAHU004VE,CAHU,Vernon,Take your time. I've got a lot of really good stories.,
CAHV000RA,CAHV,Raz,"Hey, there's this whole brain-stealing thing going on that you should know about.",
CAHV001EL,CAHV,Elka,Razputin? NOT NOW.,
CAHW001CP,CAHW,Chops,"Hey, not right now, okay Raz?",
CAHW002RA,CAHW,Raz,Chicks.,
CAHW003CP,CAHW,Chops,Tell me about it.,
CAHX004RA,CAHX,Raz,Maybe these guys are better off without their brains. They seem so nice now.,
CAHY000RA,CAHY,Raz,"You're not going to, uh, kill Benny, are you?",
CAHY001MH,CAHY,Mikhail,Difficult to say. ,
CAHZ000RA,CAHZ,Raz,"Hey, you guys aren't going around taking people's brains out, are you?",
CAHZ001MF,CAHZ,Maloof,"Not yet, but maybe we should do some market research on that, and see if there's a demand for that service.",
CAIA000LI,CAIA,Lili,Quit it! I'm trying to hear something!,
CAIB000RA,CAIB,Raz,"Hey, J.T. I could use a hired gun on this brain-stealing case I'm working on.",
CAIB001JT,CAIB,J.T.,"Huh? Oh, sorry Raz. I'm a little preoccupied right now. Got a lot of figurin' to do.",
CAIC002RA,CAIC,Raz,"You should take advantage of this time to quietly reflect upon your life, Benny.",
CAIC003BN,CAIC,Benny,"Raz, buddy! You gotta help me!",
CAID000EF,CAID,Elton,"Not NOW, Raz!",
CAID001RA,CAID,Raz,"Hey, you guys want to go do something?",
CAID002RA,CAID,Raz,Watch TV or something?,
CAID003RA,CAID,Raz,Want to help me find Dogen's brains?,
CAID004RA,CAID,Raz,They're missing.,
CAID005EF,CAID,Elton,"Mmf. No, he's just like that. Mffm.",
CAID006RA,CAID,Raz,"I, uh, I beat Bobby in this Levitation race. It was pretty cool.",
CAID007RA,CAID,Raz,"I got a, uh... Oarsman's Badge, so I can get us a canoe if you guys want to go... canoeing.",
CAID008RA,CAID,Raz,"Have you guys ever jumped down these big, hollow stumps they have all around camp?",
CAID009RA,CAID,Raz,No?,
CAID010RA,CAID,Raz,"Okay, ummm, I'm gonna go back to Sasha's secret lab now. If you guys need me, that's where I'll be.",
CAIE000RA,CAIE,Raz,Yes! I got a brain!,
CAIF000FO,CAIF,Ford,"Well, the good thing about you finding that kid's brain--besides the whole thinking and feeling they'll be able to do now--",
CAIF001FO,CAIF,Ford,"is that they will be adding their subconscious mental attention to your quest, and their energy will increase your mental health potential!",
CAIF002RA,CAIF,Raz,"That sounds great, but is the surgery going to be dangerous?",
CAIF003FO,CAIF,Ford,Nothing's dangerous when you have the right tools. ,
CAIF004FO,CAIF,Ford,"Messy, yes, but not dangerous.",
CAIF005RA,CAIF,Raz,...and so that's what happened to your brain.,
CAIF006RA,CAIF,Raz,...and that's how the Coach is planning to take over the world.,
CAIF007RA,CAIF,Raz,...so that's who's been kidnapping all the kids.,
CAIF008RA,CAIF,Raz,...and that's why we have to find Lili right away.,
CAIF009RA,CAIF,Raz,"...so, any questions?",
CAIF010RA,CAIF,Raz,"...and so that's why, even though she is a girl, and we are good friends, she is not, technically, my ""girlfriend.""",
CAIF011RA,CAIF,Raz,"...and that is how I beat the Hideous, Hulking Lungfish of Lake Oblongata.",
CAIF012RA,CAIF,Raz,...and then the Lungfish ate me and we became best friends.,
CAIF013RA,CAIF,Raz,...and that's why finding your brain in particular was my highest priority.,
CAIF014RA,CAIF,Raz,"...so, as you can imagine, we are in some bad trouble.",
CAIF015RA,CAIF,Raz,"...that's a good question. But I didn't taste it, so I don't really know the answer for sure.",
CAIF016RA,CAIF,Raz,...and that's why we need your help more than anybody's.,
CAIF017RA,CAIF,Raz,"...and so--long story short--we're hoping for the best, but preparing for the worst.",
CAIF018RA,CAIF,Raz,...and that's how I earned all my merit badges.,
CAIF019RA,CAIF,Raz,Scared? You'd better believe I was scared. You'd have to be a fool not to be. But the trick is to never let them see you sweat!,
CAIF020RA,CAIF,Raz,"...so I said, ""Brainer? I don't even know her!"" Ha ha!",
CAIF021RA,CAIF,Raz,"...no, you can't have the bracelet. She made it for me.",
CAIF022RA,CAIF,Raz,"...no, I promise you. You didn't drool at all.",
CAIF023RA,CAIF,Raz,...The end!,
CAIG000VE,CAIG,Vernon,Not now Raz. I'm trying to finish writing my memoirs before we all die.,
CAIG001RA,CAIG,Raz,"Hey, want to help me save the world?",
CAIG002VE,CAIG,Vernon,Oh man. Gotta work a little turtle with a crown into the story somehow. Hm. Maybe he can be my little wisecracking sidekick.,
CAIH000NI,CAIH,Nils,Don't you have a world to save or something?,
CAIH001NI,CAIH,Nils,"Maybe after I get just a couple good, end of the world hook up sessions in, okay?",
CAIH002NI,CAIH,Nils,I thought this would be a good spot. This is where I hooked up with what's her name the first time. Elka.,
CAIH003NI,CAIH,Nils,Mister? Don't you have any FEMALE friends you can introduce me to?,
CAIH004EL,CAIH,Elka,Pig!,
CAII000EL,CAII,Elka,"Please, I want to be alone. Here on this spot where Nils and I first spoke of our love.",
CAII001EL,CAII,Elka,Can't you see that we're too busy being in love?,
CAII002EL,CAII,Elka,"Oh, Mr. Pokeylope. I wish I had a hard shell like yours. Around my heart.",
CAIJ000DO,CAIJ,Dogen,"Hey, I said I was sorry!",
CAIJ001DO,CAIJ,Dogen,"Well, this could take a while. They're really mad.",
CAIJ002DO,CAIJ,Dogen,Hi. I like your hat.,
CAIK000EF,CAIK,Elton,Ow.,
CAIK001EF,CAIK,Elton,I'm going to wait for Milka to show up. She always knows what to do.,
CAIK002EF,CAIK,Elton,Mmmf. Later. Mmmlf.,
CAIK003EF,CAIK,Elton,Mmmf. Hi. Mmmlf.,
CAIL000KI,CAIL,Kitty,Quit it! This polish isn't dry yet!,
CAIL001KI,CAIL,Kitty,HMM... nope.,
CAIL002KI,CAIL,Kitty,Pff. My dad bought me a bigger turtle than that for my birthday.,
CAIN000FA,CAIN,Franke,Ahhh!,
CAIN001FA,CAIN,Franke,HMM nope.,
CAIN002FA,CAIN,Franke,Glad you finally got a friend.,
CAIP000MH,CAIP,Mikhail,Shall I come out and hurt people?,
CAIP001MF,CAIP,Maloof,"No, keep working.",
CAIP002MF,CAIP,Maloof,"We are. This is how we handle things, in my family.",
CAIP003MF,CAIP,Maloof,"Seems like a nice turtle. You shouldn't get him involved in this mess, Raz.",
CAIQ000CM,CAIQ,Clem,Yay! Mr. Cruller!,
CAIQ001CM,CAIQ,Clem,Mop! Mop! Mop!,
CAIQ002CM,CAIQ,Clem,"Mooooooop, hurray!",
CAIQ003CM,CAIQ,Clem,"Mop, moppy mop-mop!",
